_id,listing_id,photo_url,priority,caption
4505,308,http://lorempixel.com/640/480/city,8,Non aspernatur delectus enim neque.
4506,308,http://lorempixel.com/640/480/city,9,A perferendis natus assumenda veritatis.
4507,308,http://lorempixel.com/640/480/city,10,Cumque voluptatem nihil quia ab.
4508,308,http://lorempixel.com/640/480/city,11,Distinctio autem ducimus deserunt sit.
4509,308,http://lorempixel.com/640/480/city,12,Ea esse ea tenetur sit.
4510,308,http://lorempixel.com/640/480/city,13,Provident quod aliquam saepe est.
4511,308,http://lorempixel.com/640/480/city,14,Aut debitis sequi laudantium ratione.
4512,308,http://lorempixel.com/640/480/city,15,Sit amet sed deleniti qui.
4513,308,http://lorempixel.com/640/480/city,16,Sed doloribus quia iste sequi.
4514,308,http://lorempixel.com/640/480/city,17,Sint voluptatem ut similique cupiditate.
4515,308,http://lorempixel.com/640/480/city,18,Nesciunt architecto quisquam nam dolores.
4516,308,http://lorempixel.com/640/480/city,19,Dolores nihil et eum deleniti.
4517,309,http://lorempixel.com/640/480/city,0,Eaque voluptatibus ut nesciunt et.
4518,309,http://lorempixel.com/640/480/city,1,Excepturi enim quis cumque eum.
4519,309,http://lorempixel.com/640/480/city,2,Possimus aut fugiat quis quisquam.
4520,309,http://lorempixel.com/640/480/city,3,Delectus itaque fugit eum dolores.
4521,309,http://lorempixel.com/640/480/city,4,Magni officiis quo beatae cum.
4522,309,http://lorempixel.com/640/480/city,5,Eaque eos eum est eius.
4523,309,http://lorempixel.com/640/480/city,6,Maiores neque odit consequatur qui.
4524,309,http://lorempixel.com/640/480/city,7,Voluptate facilis ullam ut eos.
4525,309,http://lorempixel.com/640/480/city,8,Suscipit consectetur qui laudantium et.
4526,309,http://lorempixel.com/640/480/city,9,Sequi autem qui ut nobis.
4527,309,http://lorempixel.com/640/480/city,10,Distinctio pariatur numquam omnis asperiores.
4528,309,http://lorempixel.com/640/480/city,11,Saepe quia non et incidunt.
4529,309,http://lorempixel.com/640/480/city,12,Perferendis illo maxime eaque aut.
4530,309,http://lorempixel.com/640/480/city,13,Provident sit eaque voluptate expedita.
4531,309,http://lorempixel.com/640/480/city,14,Ab qui sit ducimus soluta.
4532,309,http://lorempixel.com/640/480/city,15,Ratione odio aut eum exercitationem.
4533,309,http://lorempixel.com/640/480/city,16,In magnam vitae libero et.
4534,309,http://lorempixel.com/640/480/city,17,Qui cum odio non modi.
4535,309,http://lorempixel.com/640/480/city,18,Fugit perferendis expedita aperiam sed.
4536,309,http://lorempixel.com/640/480/city,19,Nihil nemo voluptates aperiam et.
4537,309,http://lorempixel.com/640/480/city,20,Aut quidem aperiam commodi quis.
4538,309,http://lorempixel.com/640/480/city,21,Ad eos minus alias dolores.
4539,309,http://lorempixel.com/640/480/city,22,Sed in rem natus sed.
4540,309,http://lorempixel.com/640/480/city,23,Perferendis mollitia qui tenetur ea.
4541,310,http://lorempixel.com/640/480/city,0,Sequi autem natus sint autem.
4542,310,http://lorempixel.com/640/480/city,1,Illo ut dolorem natus quo.
4543,310,http://lorempixel.com/640/480/city,2,Officia at sapiente adipisci fugit.
4544,310,http://lorempixel.com/640/480/city,3,Voluptatem ut dolorum enim vel.
4545,310,http://lorempixel.com/640/480/city,4,Occaecati molestiae perspiciatis iusto voluptas.
4546,310,http://lorempixel.com/640/480/city,5,Qui aut esse et totam.
4547,310,http://lorempixel.com/640/480/city,6,Est dignissimos excepturi qui praesentium.
4548,310,http://lorempixel.com/640/480/city,7,Qui eius provident culpa quod.
4549,310,http://lorempixel.com/640/480/city,8,Labore laudantium dolorem assumenda harum.
4550,310,http://lorempixel.com/640/480/city,9,Ducimus suscipit exercitationem ullam et.
4551,310,http://lorempixel.com/640/480/city,10,Et dignissimos reprehenderit quia ratione.
4552,310,http://lorempixel.com/640/480/city,11,Voluptatibus delectus porro maiores nobis.
4553,310,http://lorempixel.com/640/480/city,12,Doloribus et odit eaque dicta.
4554,310,http://lorempixel.com/640/480/city,13,Et inventore voluptatibus accusamus et.
4555,310,http://lorempixel.com/640/480/city,14,Magni quia nihil unde est.
4556,310,http://lorempixel.com/640/480/city,15,Non omnis et doloremque asperiores.
4557,310,http://lorempixel.com/640/480/city,16,Quia occaecati at autem nihil.
4558,310,http://lorempixel.com/640/480/city,17,Aut nihil omnis eum molestiae.
4559,310,http://lorempixel.com/640/480/city,18,Minima sint deserunt omnis amet.
4560,310,http://lorempixel.com/640/480/city,19,Et dolores alias aut ab.
4561,310,http://lorempixel.com/640/480/city,20,Velit aut ut accusamus consequuntur.
4562,310,http://lorempixel.com/640/480/city,21,Fugiat aut deleniti ut aspernatur.
4563,310,http://lorempixel.com/640/480/city,22,Repudiandae dolorem velit sint nihil.
4564,310,http://lorempixel.com/640/480/city,23,Eum est eum quod veniam.
4565,310,http://lorempixel.com/640/480/city,24,In laboriosam est provident placeat.
4566,310,http://lorempixel.com/640/480/city,25,Quia vel ea commodi architecto.
4567,310,http://lorempixel.com/640/480/city,26,Harum vel at aliquam laboriosam.
4568,310,http://lorempixel.com/640/480/city,27,Ipsum ex exercitationem neque esse.
4569,311,http://lorempixel.com/640/480/city,0,Dolorum et deserunt dolorum similique.
4570,311,http://lorempixel.com/640/480/city,1,Quia eveniet corrupti voluptatem dolore.
4571,311,http://lorempixel.com/640/480/city,2,Maiores aliquid ut beatae expedita.
4572,311,http://lorempixel.com/640/480/city,3,Et dolorum et numquam quo.
4573,311,http://lorempixel.com/640/480/city,4,Itaque labore in nemo saepe.
4574,311,http://lorempixel.com/640/480/city,5,Architecto fuga porro tempora ipsum.
4575,311,http://lorempixel.com/640/480/city,6,Veritatis ab adipisci rerum occaecati.
4576,311,http://lorempixel.com/640/480/city,7,Aut eum eaque placeat debitis.
4577,311,http://lorempixel.com/640/480/city,8,Veniam consequatur similique omnis aliquam.
4578,311,http://lorempixel.com/640/480/city,9,Voluptas nam est et quam.
4579,311,http://lorempixel.com/640/480/city,10,Tempore quos voluptas itaque quis.
4580,311,http://lorempixel.com/640/480/city,11,Error reprehenderit atque sint quia.
4581,311,http://lorempixel.com/640/480/city,12,Illo amet omnis inventore qui.
4582,311,http://lorempixel.com/640/480/city,13,Saepe at sint commodi libero.
4583,311,http://lorempixel.com/640/480/city,14,Blanditiis iste blanditiis quam est.
4584,311,http://lorempixel.com/640/480/city,15,Quaerat veritatis officia corrupti corrupti.
4585,311,http://lorempixel.com/640/480/city,16,Quo maiores dolor dolor doloremque.
4586,311,http://lorempixel.com/640/480/city,17,Sequi eum ab amet sit.
4587,311,http://lorempixel.com/640/480/city,18,Enim quasi optio repellendus omnis.
4588,311,http://lorempixel.com/640/480/city,19,Quaerat consequatur ut recusandae voluptatem.
4589,311,http://lorempixel.com/640/480/city,20,Adipisci eos perspiciatis harum voluptatem.
4590,312,http://lorempixel.com/640/480/city,0,Libero a animi aut dolores.
4591,313,http://lorempixel.com/640/480/city,0,Officiis minus dignissimos voluptas qui.
4592,313,http://lorempixel.com/640/480/city,1,Voluptate laborum vel beatae ipsum.
4593,313,http://lorempixel.com/640/480/city,2,Sed unde fuga nemo magni.
4594,313,http://lorempixel.com/640/480/city,3,Sed quis et consequatur ut.
4595,313,http://lorempixel.com/640/480/city,4,Rerum molestiae fugiat debitis enim.
4596,313,http://lorempixel.com/640/480/city,5,Rem voluptas libero repellat aut.
4597,314,http://lorempixel.com/640/480/city,0,Velit accusamus odit illum culpa.
4598,314,http://lorempixel.com/640/480/city,1,Repellat delectus temporibus autem optio.
4599,314,http://lorempixel.com/640/480/city,2,Dolorum quos dicta aliquid non.
4600,314,http://lorempixel.com/640/480/city,3,Architecto ut sunt ea sapiente.
4601,314,http://lorempixel.com/640/480/city,4,Explicabo enim quod minus nemo.
4602,314,http://lorempixel.com/640/480/city,5,Velit voluptas harum optio quae.
4603,314,http://lorempixel.com/640/480/city,6,Voluptatem reprehenderit libero voluptatem et.
4604,314,http://lorempixel.com/640/480/city,7,Velit architecto blanditiis fugit architecto.
4605,314,http://lorempixel.com/640/480/city,8,Sunt sint iure repudiandae fugit.
4606,314,http://lorempixel.com/640/480/city,9,Aliquam vero ut hic non.
4607,315,http://lorempixel.com/640/480/city,0,Perspiciatis voluptatem sapiente temporibus ea.
4608,315,http://lorempixel.com/640/480/city,1,Exercitationem ea aut consequatur hic.
4609,315,http://lorempixel.com/640/480/city,2,Voluptate doloribus fugit qui neque.
4610,315,http://lorempixel.com/640/480/city,3,Aut exercitationem aut eius sed.
4611,315,http://lorempixel.com/640/480/city,4,Autem est voluptate sed at.
4612,315,http://lorempixel.com/640/480/city,5,Placeat et non officia inventore.
4613,315,http://lorempixel.com/640/480/city,6,Sunt omnis quis velit amet.
4614,315,http://lorempixel.com/640/480/city,7,A quis nesciunt consequuntur omnis.
4615,315,http://lorempixel.com/640/480/city,8,Saepe dolor soluta mollitia error.
4616,315,http://lorempixel.com/640/480/city,9,Quasi error qui nostrum qui.
4617,315,http://lorempixel.com/640/480/city,10,Ut sit dolores rerum dolor.
4618,315,http://lorempixel.com/640/480/city,11,Voluptas non magni vero odit.
4619,316,http://lorempixel.com/640/480/city,0,Reprehenderit ab sunt repellat atque.
4620,316,http://lorempixel.com/640/480/city,1,Sint molestias ab qui ipsum.
4621,317,http://lorempixel.com/640/480/city,0,Quos non maiores aut sint.
4622,317,http://lorempixel.com/640/480/city,1,Alias blanditiis quis ut ratione.
4623,317,http://lorempixel.com/640/480/city,2,Exercitationem est voluptas quia optio.
4624,317,http://lorempixel.com/640/480/city,3,Assumenda eveniet est nemo dolorem.
4625,317,http://lorempixel.com/640/480/city,4,Et consectetur quia cupiditate totam.
4626,317,http://lorempixel.com/640/480/city,5,Cumque qui non rerum eum.
4627,317,http://lorempixel.com/640/480/city,6,Non voluptates atque laboriosam voluptatem.
4628,317,http://lorempixel.com/640/480/city,7,Autem in veniam dolor rem.
4629,318,http://lorempixel.com/640/480/city,0,Debitis et et ut sit.
4630,318,http://lorempixel.com/640/480/city,1,Et rerum ipsa debitis est.
4631,318,http://lorempixel.com/640/480/city,2,Iure ea rerum amet provident.
4632,318,http://lorempixel.com/640/480/city,3,Eum reiciendis ratione et asperiores.
4633,318,http://lorempixel.com/640/480/city,4,Sit est et velit ea.
4634,318,http://lorempixel.com/640/480/city,5,Quis et omnis est itaque.
4635,318,http://lorempixel.com/640/480/city,6,Ut est facere explicabo et.
4636,318,http://lorempixel.com/640/480/city,7,Recusandae cumque aut natus illo.
4637,318,http://lorempixel.com/640/480/city,8,Saepe id quia et quis.
4638,318,http://lorempixel.com/640/480/city,9,Laudantium ducimus dignissimos a nesciunt.
4639,318,http://lorempixel.com/640/480/city,10,Aperiam nulla quisquam et iste.
4640,318,http://lorempixel.com/640/480/city,11,Rerum eaque earum molestiae sunt.
4641,318,http://lorempixel.com/640/480/city,12,Necessitatibus consequatur dolores et voluptate.
4642,318,http://lorempixel.com/640/480/city,13,Excepturi explicabo molestias est accusamus.
4643,318,http://lorempixel.com/640/480/city,14,Officiis ducimus aut magni qui.
4644,318,http://lorempixel.com/640/480/city,15,Earum consequatur consectetur molestiae qui.
4645,318,http://lorempixel.com/640/480/city,16,Porro itaque amet ea earum.
4646,319,http://lorempixel.com/640/480/city,0,Exercitationem ut corporis consequatur assumenda.
4647,319,http://lorempixel.com/640/480/city,1,Quaerat adipisci est hic placeat.
4648,319,http://lorempixel.com/640/480/city,2,Et sit consequatur natus doloremque.
4649,319,http://lorempixel.com/640/480/city,3,Sunt enim a asperiores eos.
4650,319,http://lorempixel.com/640/480/city,4,Aut labore sit expedita ea.
4651,319,http://lorempixel.com/640/480/city,5,Velit ex quos cumque rem.
4652,319,http://lorempixel.com/640/480/city,6,Qui et optio enim officia.
4653,319,http://lorempixel.com/640/480/city,7,Saepe et officia aliquam sit.
4654,319,http://lorempixel.com/640/480/city,8,Omnis voluptates asperiores reiciendis provident.
4655,319,http://lorempixel.com/640/480/city,9,Sint et animi autem est.
4656,319,http://lorempixel.com/640/480/city,10,Odit necessitatibus asperiores ipsa molestias.
4657,319,http://lorempixel.com/640/480/city,11,Laudantium est voluptatem nesciunt et.
4658,319,http://lorempixel.com/640/480/city,12,Neque est sit facere voluptatum.
4659,319,http://lorempixel.com/640/480/city,13,Ut aspernatur vero nihil adipisci.
4660,320,http://lorempixel.com/640/480/city,0,Rem odit consequatur aut facilis.
4661,320,http://lorempixel.com/640/480/city,1,Labore nihil illo ut aut.
4662,320,http://lorempixel.com/640/480/city,2,Dolore corrupti quos quam architecto.
4663,320,http://lorempixel.com/640/480/city,3,Hic molestiae non aut fuga.
4664,320,http://lorempixel.com/640/480/city,4,Eum sit quasi quibusdam non.
4665,320,http://lorempixel.com/640/480/city,5,Voluptate et soluta sed laudantium.
4666,320,http://lorempixel.com/640/480/city,6,Aliquid minus et enim eaque.
4667,320,http://lorempixel.com/640/480/city,7,Eum voluptatibus voluptatem dicta mollitia.
4668,320,http://lorempixel.com/640/480/city,8,Dolorem accusamus doloribus repellat sint.
4669,320,http://lorempixel.com/640/480/city,9,Laudantium quos sunt quae culpa.
4670,320,http://lorempixel.com/640/480/city,10,Atque laboriosam ut voluptatibus dolorem.
4671,320,http://lorempixel.com/640/480/city,11,Explicabo rem impedit aut vel.
4672,320,http://lorempixel.com/640/480/city,12,Accusamus soluta magnam et quia.
4673,320,http://lorempixel.com/640/480/city,13,Velit vel iure et soluta.
4674,320,http://lorempixel.com/640/480/city,14,Atque asperiores delectus fugiat rerum.
4675,320,http://lorempixel.com/640/480/city,15,Quasi ut et reiciendis pariatur.
4676,320,http://lorempixel.com/640/480/city,16,Tempore voluptate adipisci quos amet.
4677,320,http://lorempixel.com/640/480/city,17,Incidunt totam dolor quasi rerum.
4678,320,http://lorempixel.com/640/480/city,18,Laboriosam libero provident autem nobis.
4679,320,http://lorempixel.com/640/480/city,19,Atque corrupti aliquid quisquam voluptatem.
4680,320,http://lorempixel.com/640/480/city,20,Qui et libero in tenetur.
4681,320,http://lorempixel.com/640/480/city,21,Omnis magnam ratione magni cum.
4682,320,http://lorempixel.com/640/480/city,22,Et deleniti in odit magni.
4683,320,http://lorempixel.com/640/480/city,23,In quo est quo odit.
4684,320,http://lorempixel.com/640/480/city,24,Voluptates qui omnis laboriosam at.
4685,320,http://lorempixel.com/640/480/city,25,Sequi ut in et at.
4686,320,http://lorempixel.com/640/480/city,26,Et vero sed nobis et.
4687,320,http://lorempixel.com/640/480/city,27,Magnam nobis distinctio et et.
4688,320,http://lorempixel.com/640/480/city,28,Eius numquam illo voluptatem voluptatem.
4689,321,http://lorempixel.com/640/480/city,0,Perferendis aut nemo nihil dolores.
4690,321,http://lorempixel.com/640/480/city,1,Iure voluptatibus magnam impedit id.
4691,321,http://lorempixel.com/640/480/city,2,Consequuntur et deserunt magni id.
4692,321,http://lorempixel.com/640/480/city,3,Dicta quasi architecto vel praesentium.
4693,321,http://lorempixel.com/640/480/city,4,Suscipit a assumenda doloribus quidem.
4694,321,http://lorempixel.com/640/480/city,5,Ut hic ab et quis.
4695,321,http://lorempixel.com/640/480/city,6,Corrupti quidem nostrum delectus quasi.
4696,321,http://lorempixel.com/640/480/city,7,Quia consequatur sunt a a.
4697,321,http://lorempixel.com/640/480/city,8,Voluptates officiis voluptas consectetur explicabo.
4698,321,http://lorempixel.com/640/480/city,9,Occaecati laboriosam in ut expedita.
4699,321,http://lorempixel.com/640/480/city,10,Placeat qui saepe in a.
4700,321,http://lorempixel.com/640/480/city,11,Aut at ipsa nihil voluptas.
4701,322,http://lorempixel.com/640/480/city,0,Quibusdam eos laudantium non blanditiis.
4702,322,http://lorempixel.com/640/480/city,1,Ipsum eos molestias aspernatur sapiente.
4703,322,http://lorempixel.com/640/480/city,2,Esse sunt velit velit rerum.
4704,322,http://lorempixel.com/640/480/city,3,Inventore ut et fuga sit.
4705,322,http://lorempixel.com/640/480/city,4,Sequi illo dolorum pariatur delectus.
4706,322,http://lorempixel.com/640/480/city,5,Veniam rem quod qui molestiae.
4707,322,http://lorempixel.com/640/480/city,6,Aut tempore sunt et quisquam.
4708,322,http://lorempixel.com/640/480/city,7,Natus enim est minima facilis.
4709,322,http://lorempixel.com/640/480/city,8,Accusamus ea nihil iste ex.
4710,322,http://lorempixel.com/640/480/city,9,Repellendus rerum quis sit occaecati.
4711,322,http://lorempixel.com/640/480/city,10,In et pariatur distinctio ut.
4712,322,http://lorempixel.com/640/480/city,11,Omnis rerum explicabo enim voluptatem.
4713,322,http://lorempixel.com/640/480/city,12,Esse sit assumenda et aut.
4714,322,http://lorempixel.com/640/480/city,13,Sint quia quidem odio quisquam.
4715,322,http://lorempixel.com/640/480/city,14,Eligendi nihil iusto voluptas aspernatur.
4716,322,http://lorempixel.com/640/480/city,15,Magni impedit dolor aut distinctio.
4717,322,http://lorempixel.com/640/480/city,16,Qui animi dicta velit aut.
4718,322,http://lorempixel.com/640/480/city,17,Explicabo ut doloribus esse atque.
4719,322,http://lorempixel.com/640/480/city,18,Excepturi molestiae distinctio molestias ut.
4720,322,http://lorempixel.com/640/480/city,19,Assumenda consequatur odio est molestiae.
4721,322,http://lorempixel.com/640/480/city,20,Rem sint rerum aliquam expedita.
4722,322,http://lorempixel.com/640/480/city,21,Vel quos et est odio.
4723,322,http://lorempixel.com/640/480/city,22,Pariatur voluptas est velit cum.
4724,323,http://lorempixel.com/640/480/city,0,Saepe sed doloribus ab quisquam.
4725,323,http://lorempixel.com/640/480/city,1,Eos porro cum laboriosam incidunt.
4726,323,http://lorempixel.com/640/480/city,2,Nobis et consequatur aliquid dolores.
4727,323,http://lorempixel.com/640/480/city,3,Occaecati iste labore est deserunt.
4728,323,http://lorempixel.com/640/480/city,4,Quas sunt voluptas non aperiam.
4729,323,http://lorempixel.com/640/480/city,5,Hic illum est unde ut.
4730,323,http://lorempixel.com/640/480/city,6,Quaerat repellat neque natus debitis.
4731,323,http://lorempixel.com/640/480/city,7,Quod omnis animi ab aut.
4732,323,http://lorempixel.com/640/480/city,8,Quis et id porro corrupti.
4733,323,http://lorempixel.com/640/480/city,9,Nostrum eos omnis nesciunt ut.
4734,323,http://lorempixel.com/640/480/city,10,Vel voluptas voluptas quia quod.
4735,323,http://lorempixel.com/640/480/city,11,Facere vitae enim velit dolores.
4736,323,http://lorempixel.com/640/480/city,12,Rerum in animi provident et.
4737,323,http://lorempixel.com/640/480/city,13,Quia et excepturi nesciunt ut.
4738,323,http://lorempixel.com/640/480/city,14,Rerum in exercitationem necessitatibus voluptatum.
4739,323,http://lorempixel.com/640/480/city,15,Magni cum culpa aut accusamus.
4740,323,http://lorempixel.com/640/480/city,16,Laudantium ipsam quos quos provident.
4741,323,http://lorempixel.com/640/480/city,17,Aut pariatur praesentium doloribus sint.
4742,323,http://lorempixel.com/640/480/city,18,Provident et ut aut asperiores.
4743,324,http://lorempixel.com/640/480/city,0,Cumque numquam sed quae ea.
4744,324,http://lorempixel.com/640/480/city,1,Labore debitis iste aut tenetur.
4745,324,http://lorempixel.com/640/480/city,2,Ducimus omnis possimus ut optio.
4746,324,http://lorempixel.com/640/480/city,3,Velit est quibusdam ullam vitae.
4747,324,http://lorempixel.com/640/480/city,4,In voluptatibus sequi quas cumque.
4748,324,http://lorempixel.com/640/480/city,5,Tenetur fugiat perferendis aliquam explicabo.
4749,324,http://lorempixel.com/640/480/city,6,Deleniti id minus repellat minima.
4750,324,http://lorempixel.com/640/480/city,7,Aperiam ut et veniam rerum.
4751,324,http://lorempixel.com/640/480/city,8,Voluptas eos dolores quisquam ratione.
4752,324,http://lorempixel.com/640/480/city,9,Unde non occaecati consequatur quidem.
4753,324,http://lorempixel.com/640/480/city,10,Aut vel magnam tempore labore.
4754,324,http://lorempixel.com/640/480/city,11,Repellendus amet repellat quo dolorem.
4755,324,http://lorempixel.com/640/480/city,12,Eum et ducimus veniam voluptatem.
4756,324,http://lorempixel.com/640/480/city,13,Perferendis nesciunt numquam possimus itaque.
4757,324,http://lorempixel.com/640/480/city,14,Ratione beatae ducimus ea eveniet.
4758,324,http://lorempixel.com/640/480/city,15,Consequatur maiores distinctio culpa ex.
4759,324,http://lorempixel.com/640/480/city,16,Sapiente possimus et nihil doloremque.
4760,324,http://lorempixel.com/640/480/city,17,Magni et voluptatum vel assumenda.
4761,324,http://lorempixel.com/640/480/city,18,Non id aut facere non.
4762,324,http://lorempixel.com/640/480/city,19,Eveniet quia atque quisquam nesciunt.
4763,325,http://lorempixel.com/640/480/city,0,Odio fugit voluptatem dolor aut.
4764,325,http://lorempixel.com/640/480/city,1,Aspernatur qui exercitationem modi aut.
4765,325,http://lorempixel.com/640/480/city,2,Voluptates in explicabo soluta officia.
4766,325,http://lorempixel.com/640/480/city,3,Numquam ipsa ipsam doloremque ut.
4767,325,http://lorempixel.com/640/480/city,4,Eum magnam nisi fugiat tenetur.
4768,325,http://lorempixel.com/640/480/city,5,Sed repellat voluptas dolore alias.
4769,325,http://lorempixel.com/640/480/city,6,Est quisquam beatae velit voluptatum.
4770,325,http://lorempixel.com/640/480/city,7,Et optio enim ut placeat.
4771,325,http://lorempixel.com/640/480/city,8,Cupiditate id ut eum aut.
4772,325,http://lorempixel.com/640/480/city,9,Voluptas quia quo qui quos.
4773,326,http://lorempixel.com/640/480/city,0,Nihil voluptas provident iste ipsum.
4774,326,http://lorempixel.com/640/480/city,1,Doloremque dicta est exercitationem laudantium.
4775,326,http://lorempixel.com/640/480/city,2,Id quo similique quis quia.
4776,326,http://lorempixel.com/640/480/city,3,Et est nihil et voluptate.
4777,327,http://lorempixel.com/640/480/city,0,Dolorem provident et sit nam.
4778,327,http://lorempixel.com/640/480/city,1,Repudiandae ex eius officia quo.
4779,327,http://lorempixel.com/640/480/city,2,Qui doloremque velit harum dignissimos.
4780,327,http://lorempixel.com/640/480/city,3,Id eum dolorem voluptas et.
4781,327,http://lorempixel.com/640/480/city,4,Doloremque sequi eaque autem voluptas.
4782,327,http://lorempixel.com/640/480/city,5,Dolores ut ex omnis sit.
4783,327,http://lorempixel.com/640/480/city,6,Dolor consequatur non in est.
4784,327,http://lorempixel.com/640/480/city,7,Ut natus consequatur aliquid et.
4785,327,http://lorempixel.com/640/480/city,8,Eum aut ut possimus eum.
4786,327,http://lorempixel.com/640/480/city,9,Pariatur recusandae dolor molestias est.
4787,327,http://lorempixel.com/640/480/city,10,Dolorum eius dolor est magnam.
4788,327,http://lorempixel.com/640/480/city,11,Optio aliquid ipsum neque velit.
4789,327,http://lorempixel.com/640/480/city,12,Voluptate minima voluptas autem ullam.
4790,327,http://lorempixel.com/640/480/city,13,Dolor doloribus nulla eius assumenda.
4791,327,http://lorempixel.com/640/480/city,14,Necessitatibus quia aut commodi repellat.
4792,327,http://lorempixel.com/640/480/city,15,Soluta quidem omnis voluptatem quia.
4793,327,http://lorempixel.com/640/480/city,16,Suscipit provident ipsam tempore qui.
4794,327,http://lorempixel.com/640/480/city,17,Sint cumque eos tenetur deleniti.
4795,327,http://lorempixel.com/640/480/city,18,Sint consectetur ut enim non.
4796,327,http://lorempixel.com/640/480/city,19,Aut eaque assumenda nostrum itaque.
4797,327,http://lorempixel.com/640/480/city,20,Rerum sunt inventore aliquam voluptates.
4798,327,http://lorempixel.com/640/480/city,21,Possimus perferendis eius temporibus consequatur.
4799,327,http://lorempixel.com/640/480/city,22,Minus nesciunt incidunt expedita corporis.
4800,327,http://lorempixel.com/640/480/city,23,Iusto est et distinctio suscipit.
4801,327,http://lorempixel.com/640/480/city,24,Vero commodi voluptas quod est.
4802,327,http://lorempixel.com/640/480/city,25,Perferendis sit laudantium est officia.
4803,327,http://lorempixel.com/640/480/city,26,Architecto aut libero nobis error.
4804,327,http://lorempixel.com/640/480/city,27,Eos eum qui iste sunt.
4805,327,http://lorempixel.com/640/480/city,28,Hic optio tempore reprehenderit voluptas.
4806,328,http://lorempixel.com/640/480/city,0,Est eos saepe laborum repudiandae.
4807,328,http://lorempixel.com/640/480/city,1,Ea et sed maiores dolor.
4808,328,http://lorempixel.com/640/480/city,2,Perspiciatis consequuntur culpa dolor saepe.
4809,328,http://lorempixel.com/640/480/city,3,Distinctio odit blanditiis quam architecto.
4810,328,http://lorempixel.com/640/480/city,4,Quo et magnam at quidem.
4811,329,http://lorempixel.com/640/480/city,0,Qui officia ut ad qui.
4812,329,http://lorempixel.com/640/480/city,1,Qui sunt dolore autem sed.
4813,329,http://lorempixel.com/640/480/city,2,Est reiciendis assumenda iusto et.
4814,329,http://lorempixel.com/640/480/city,3,Eum facere sunt ut modi.
4815,329,http://lorempixel.com/640/480/city,4,Voluptas nostrum sint est voluptas.
4816,329,http://lorempixel.com/640/480/city,5,Cupiditate ipsum blanditiis reprehenderit ipsam.
4817,329,http://lorempixel.com/640/480/city,6,Repudiandae perferendis aut ducimus ab.
4818,329,http://lorempixel.com/640/480/city,7,Assumenda at sit vel unde.
4819,329,http://lorempixel.com/640/480/city,8,Veniam neque aut animi non.
4820,329,http://lorempixel.com/640/480/city,9,Maxime vitae inventore enim aliquam.
4821,329,http://lorempixel.com/640/480/city,10,Facilis quasi quia fugit aliquid.
4822,329,http://lorempixel.com/640/480/city,11,Illum officiis minus illum qui.
4823,329,http://lorempixel.com/640/480/city,12,Ullam porro eius sunt harum.
4824,329,http://lorempixel.com/640/480/city,13,Facere et consequatur adipisci sapiente.
4825,329,http://lorempixel.com/640/480/city,14,Iure doloribus exercitationem fugit culpa.
