_id,listing_id,photo_url,priority,caption
2905,200,http://lorempixel.com/640/480/city,25,Ex dolorum non nisi repellat.
2906,200,http://lorempixel.com/640/480/city,26,Sit placeat voluptas voluptatibus est.
2907,200,http://lorempixel.com/640/480/city,27,Assumenda quia et sit ab.
2908,201,http://lorempixel.com/640/480/city,0,Est in impedit et quo.
2909,201,http://lorempixel.com/640/480/city,1,Qui quas rerum sed necessitatibus.
2910,201,http://lorempixel.com/640/480/city,2,Velit iure eveniet voluptas dolores.
2911,201,http://lorempixel.com/640/480/city,3,Officiis repellendus quia totam et.
2912,201,http://lorempixel.com/640/480/city,4,Eos consequatur vitae quia adipisci.
2913,201,http://lorempixel.com/640/480/city,5,Corporis quae consequatur labore tempora.
2914,201,http://lorempixel.com/640/480/city,6,Et et sint explicabo velit.
2915,202,http://lorempixel.com/640/480/city,0,Magni dolores molestias earum dolor.
2916,202,http://lorempixel.com/640/480/city,1,Vitae vel quo commodi eum.
2917,202,http://lorempixel.com/640/480/city,2,Sed quos perspiciatis nulla molestiae.
2918,202,http://lorempixel.com/640/480/city,3,Incidunt saepe quas perspiciatis odit.
2919,202,http://lorempixel.com/640/480/city,4,Incidunt iste autem aut fuga.
2920,202,http://lorempixel.com/640/480/city,5,Culpa praesentium enim iste aut.
2921,202,http://lorempixel.com/640/480/city,6,Qui sequi officia commodi numquam.
2922,202,http://lorempixel.com/640/480/city,7,Fuga et quidem vero doloremque.
2923,202,http://lorempixel.com/640/480/city,8,Voluptatem dicta accusantium rem nostrum.
2924,202,http://lorempixel.com/640/480/city,9,Error qui eaque quis ipsam.
2925,202,http://lorempixel.com/640/480/city,10,Eos voluptatem corrupti deserunt voluptas.
2926,202,http://lorempixel.com/640/480/city,11,Quo et id consectetur sed.
2927,202,http://lorempixel.com/640/480/city,12,Nulla laborum amet officia quam.
2928,202,http://lorempixel.com/640/480/city,13,Earum et est et et.
2929,202,http://lorempixel.com/640/480/city,14,Rerum quod illo ut itaque.
2930,202,http://lorempixel.com/640/480/city,15,Id accusamus tempora exercitationem sunt.
2931,202,http://lorempixel.com/640/480/city,16,Ratione enim aliquid eligendi facilis.
2932,202,http://lorempixel.com/640/480/city,17,Cum laborum nihil non ipsam.
2933,202,http://lorempixel.com/640/480/city,18,Nemo voluptatem magnam non impedit.
2934,202,http://lorempixel.com/640/480/city,19,Aut eum quas a dicta.
2935,202,http://lorempixel.com/640/480/city,20,Fuga et nostrum maxime velit.
2936,202,http://lorempixel.com/640/480/city,21,Nihil aut in voluptatem laboriosam.
2937,202,http://lorempixel.com/640/480/city,22,Voluptatem voluptatem quia qui necessitatibus.
2938,203,http://lorempixel.com/640/480/city,0,Perferendis doloremque delectus ut omnis.
2939,204,http://lorempixel.com/640/480/city,0,Eveniet impedit dolor minus nostrum.
2940,204,http://lorempixel.com/640/480/city,1,Omnis veniam quos sed esse.
2941,204,http://lorempixel.com/640/480/city,2,Dolor dolores mollitia dignissimos aliquid.
2942,205,http://lorempixel.com/640/480/city,0,Laboriosam nobis qui illo doloremque.
2943,205,http://lorempixel.com/640/480/city,1,Culpa dolore nobis similique ut.
2944,205,http://lorempixel.com/640/480/city,2,Dicta non qui consequatur in.
2945,205,http://lorempixel.com/640/480/city,3,Molestiae est sit voluptatem et.
2946,205,http://lorempixel.com/640/480/city,4,Aliquam nihil qui dolor voluptatibus.
2947,205,http://lorempixel.com/640/480/city,5,Ratione odio enim voluptatem voluptates.
2948,205,http://lorempixel.com/640/480/city,6,Delectus nam amet cupiditate minus.
2949,205,http://lorempixel.com/640/480/city,7,Eos doloribus aut amet animi.
2950,205,http://lorempixel.com/640/480/city,8,Sed est ducimus quae reiciendis.
2951,205,http://lorempixel.com/640/480/city,9,Qui culpa est qui dolor.
2952,205,http://lorempixel.com/640/480/city,10,Commodi similique debitis quos eos.
2953,205,http://lorempixel.com/640/480/city,11,Consequatur ipsum sunt sint explicabo.
2954,205,http://lorempixel.com/640/480/city,12,Aliquam voluptatum amet porro consequatur.
2955,205,http://lorempixel.com/640/480/city,13,Ea est sunt consequuntur ipsum.
2956,205,http://lorempixel.com/640/480/city,14,Voluptas id aut voluptas eveniet.
2957,205,http://lorempixel.com/640/480/city,15,Velit voluptatem sed qui in.
2958,205,http://lorempixel.com/640/480/city,16,Non aut saepe amet ad.
2959,205,http://lorempixel.com/640/480/city,17,Eos sapiente ipsam voluptatem omnis.
2960,205,http://lorempixel.com/640/480/city,18,Exercitationem odio eum dolorem illum.
2961,205,http://lorempixel.com/640/480/city,19,Totam sapiente pariatur sint ut.
2962,206,http://lorempixel.com/640/480/city,0,Et iure qui et nobis.
2963,206,http://lorempixel.com/640/480/city,1,Repudiandae quasi et fugit quam.
2964,206,http://lorempixel.com/640/480/city,2,Aut quibusdam nihil labore repellat.
2965,206,http://lorempixel.com/640/480/city,3,Id necessitatibus culpa placeat sint.
2966,206,http://lorempixel.com/640/480/city,4,Quis cum voluptate impedit autem.
2967,206,http://lorempixel.com/640/480/city,5,Dicta ut ea sapiente sit.
2968,206,http://lorempixel.com/640/480/city,6,Illo et autem modi cupiditate.
2969,206,http://lorempixel.com/640/480/city,7,Harum officia inventore dolorum consequatur.
2970,206,http://lorempixel.com/640/480/city,8,Sed at libero est enim.
2971,206,http://lorempixel.com/640/480/city,9,Voluptatem aut est quidem harum.
2972,206,http://lorempixel.com/640/480/city,10,Modi recusandae saepe praesentium incidunt.
2973,206,http://lorempixel.com/640/480/city,11,Nesciunt dolor in numquam maiores.
2974,206,http://lorempixel.com/640/480/city,12,Non nisi quia ut harum.
2975,206,http://lorempixel.com/640/480/city,13,Aut sint sint sed mollitia.
2976,206,http://lorempixel.com/640/480/city,14,Fugiat non ut sint provident.
2977,206,http://lorempixel.com/640/480/city,15,Ut consequatur qui est aut.
2978,206,http://lorempixel.com/640/480/city,16,Aut ad et minima natus.
2979,206,http://lorempixel.com/640/480/city,17,Eaque placeat reprehenderit adipisci mollitia.
2980,206,http://lorempixel.com/640/480/city,18,Error qui omnis quod sed.
2981,206,http://lorempixel.com/640/480/city,19,Quibusdam animi modi perferendis sunt.
2982,206,http://lorempixel.com/640/480/city,20,Voluptatum blanditiis tenetur necessitatibus saepe.
2983,206,http://lorempixel.com/640/480/city,21,Quaerat sed placeat molestiae sunt.
2984,206,http://lorempixel.com/640/480/city,22,Corrupti voluptatibus et animi et.
2985,206,http://lorempixel.com/640/480/city,23,Saepe cupiditate facere provident officiis.
2986,208,http://lorempixel.com/640/480/city,0,Aperiam explicabo cum quibusdam eos.
2987,208,http://lorempixel.com/640/480/city,1,Aut omnis quod illo non.
2988,208,http://lorempixel.com/640/480/city,2,Perspiciatis rerum cum quam distinctio.
2989,208,http://lorempixel.com/640/480/city,3,Occaecati autem quis quam est.
2990,208,http://lorempixel.com/640/480/city,4,Unde explicabo doloribus nesciunt enim.
2991,208,http://lorempixel.com/640/480/city,5,Laudantium explicabo ex recusandae beatae.
2992,208,http://lorempixel.com/640/480/city,6,Et molestias corporis id aspernatur.
2993,208,http://lorempixel.com/640/480/city,7,Tenetur vel iste ad nemo.
2994,208,http://lorempixel.com/640/480/city,8,Rerum et recusandae vel ipsum.
2995,208,http://lorempixel.com/640/480/city,9,Rerum dignissimos asperiores eum voluptatem.
2996,208,http://lorempixel.com/640/480/city,10,Ducimus animi corporis est sit.
2997,208,http://lorempixel.com/640/480/city,11,Inventore praesentium inventore et ut.
2998,208,http://lorempixel.com/640/480/city,12,Occaecati ut recusandae fuga voluptatibus.
2999,208,http://lorempixel.com/640/480/city,13,Inventore voluptatum tempora officiis atque.
3000,208,http://lorempixel.com/640/480/city,14,Et enim soluta necessitatibus alias.
3001,208,http://lorempixel.com/640/480/city,15,Veritatis facilis eius corrupti praesentium.
3002,208,http://lorempixel.com/640/480/city,16,Non et laboriosam ratione tenetur.
3003,208,http://lorempixel.com/640/480/city,17,Pariatur doloremque est incidunt aspernatur.
3004,208,http://lorempixel.com/640/480/city,18,Excepturi aut et laboriosam adipisci.
3005,208,http://lorempixel.com/640/480/city,19,Ducimus accusantium qui velit architecto.
3006,208,http://lorempixel.com/640/480/city,20,Ad cum rerum est beatae.
3007,208,http://lorempixel.com/640/480/city,21,Qui velit aut excepturi minus.
3008,208,http://lorempixel.com/640/480/city,22,Quis aliquid vero reiciendis consequuntur.
3009,208,http://lorempixel.com/640/480/city,23,Qui est nemo ipsum hic.
3010,209,http://lorempixel.com/640/480/city,0,Voluptas amet corporis rerum incidunt.
3011,209,http://lorempixel.com/640/480/city,1,Totam id et fuga rerum.
3012,209,http://lorempixel.com/640/480/city,2,Et dicta odio est quo.
3013,209,http://lorempixel.com/640/480/city,3,Nesciunt consequatur pariatur id ut.
3014,209,http://lorempixel.com/640/480/city,4,Tempora voluptates ratione officiis aliquam.
3015,210,http://lorempixel.com/640/480/city,0,Et alias cupiditate consequatur ut.
3016,210,http://lorempixel.com/640/480/city,1,Veniam consequatur explicabo vitae ipsum.
3017,210,http://lorempixel.com/640/480/city,2,Et cum quod fuga molestiae.
3018,210,http://lorempixel.com/640/480/city,3,Maiores voluptatibus aperiam quod delectus.
3019,210,http://lorempixel.com/640/480/city,4,Consequatur dignissimos accusantium consequatur delectus.
3020,210,http://lorempixel.com/640/480/city,5,Velit laborum impedit consectetur amet.
3021,210,http://lorempixel.com/640/480/city,6,Nesciunt aliquam molestiae ex minus.
3022,210,http://lorempixel.com/640/480/city,7,Ut quia facilis consequatur et.
3023,210,http://lorempixel.com/640/480/city,8,Facere quia fuga debitis non.
3024,210,http://lorempixel.com/640/480/city,9,Nobis blanditiis ut exercitationem ex.
3025,211,http://lorempixel.com/640/480/city,0,Totam sunt placeat rerum voluptas.
3026,211,http://lorempixel.com/640/480/city,1,Consequatur id illum provident ipsam.
3027,211,http://lorempixel.com/640/480/city,2,Sed sunt libero saepe tempore.
3028,211,http://lorempixel.com/640/480/city,3,Vel voluptatum maxime adipisci nihil.
3029,211,http://lorempixel.com/640/480/city,4,Quo eius omnis distinctio ut.
3030,211,http://lorempixel.com/640/480/city,5,Est saepe quis laboriosam repellat.
3031,211,http://lorempixel.com/640/480/city,6,Quibusdam consequatur rem error velit.
3032,211,http://lorempixel.com/640/480/city,7,Magnam cum veritatis qui architecto.
3033,211,http://lorempixel.com/640/480/city,8,Rerum et quisquam quia dolorem.
3034,211,http://lorempixel.com/640/480/city,9,Temporibus saepe molestiae accusantium debitis.
3035,211,http://lorempixel.com/640/480/city,10,Voluptatibus accusamus dolore aut sapiente.
3036,211,http://lorempixel.com/640/480/city,11,Expedita ipsum et aut atque.
3037,211,http://lorempixel.com/640/480/city,12,Quo hic explicabo praesentium commodi.
3038,211,http://lorempixel.com/640/480/city,13,Vel et et voluptas pariatur.
3039,211,http://lorempixel.com/640/480/city,14,Cupiditate officia voluptate aut pariatur.
3040,212,http://lorempixel.com/640/480/city,0,Totam voluptatum et inventore sint.
3041,212,http://lorempixel.com/640/480/city,1,Qui aperiam qui ut est.
3042,212,http://lorempixel.com/640/480/city,2,Quasi eum dolorem aspernatur nihil.
3043,212,http://lorempixel.com/640/480/city,3,Hic error quia in sed.
3044,213,http://lorempixel.com/640/480/city,0,Nemo laudantium laboriosam exercitationem et.
3045,213,http://lorempixel.com/640/480/city,1,Eum et sunt itaque natus.
3046,213,http://lorempixel.com/640/480/city,2,Qui hic optio repellat ducimus.
3047,213,http://lorempixel.com/640/480/city,3,Similique quisquam est omnis qui.
3048,213,http://lorempixel.com/640/480/city,4,Sit similique quo eum a.
3049,213,http://lorempixel.com/640/480/city,5,Ipsa facilis ut ab autem.
3050,213,http://lorempixel.com/640/480/city,6,Exercitationem quis voluptatibus mollitia fuga.
3051,213,http://lorempixel.com/640/480/city,7,Voluptas velit sunt et nobis.
3052,213,http://lorempixel.com/640/480/city,8,Officia animi dolorem dolores omnis.
3053,213,http://lorempixel.com/640/480/city,9,Ut quia provident consequatur et.
3054,213,http://lorempixel.com/640/480/city,10,Porro alias debitis veniam quo.
3055,213,http://lorempixel.com/640/480/city,11,Et non voluptatem sapiente impedit.
3056,213,http://lorempixel.com/640/480/city,12,Voluptas placeat aut eligendi sed.
3057,213,http://lorempixel.com/640/480/city,13,Est quis repellat dicta eveniet.
3058,213,http://lorempixel.com/640/480/city,14,Magni error doloribus ea in.
3059,214,http://lorempixel.com/640/480/city,0,Ut tempore magnam velit iusto.
3060,214,http://lorempixel.com/640/480/city,1,Repellendus consequuntur dolores voluptatem sint.
3061,214,http://lorempixel.com/640/480/city,2,Esse quia minus est eos.
3062,214,http://lorempixel.com/640/480/city,3,Incidunt ex quisquam at molestias.
3063,214,http://lorempixel.com/640/480/city,4,Architecto voluptatem reprehenderit autem sed.
3064,214,http://lorempixel.com/640/480/city,5,Voluptatum explicabo nam quod repudiandae.
3065,214,http://lorempixel.com/640/480/city,6,Et consequatur exercitationem eum voluptas.
3066,214,http://lorempixel.com/640/480/city,7,Laboriosam aspernatur sit consequatur sapiente.
3067,214,http://lorempixel.com/640/480/city,8,Molestias qui omnis natus deserunt.
3068,214,http://lorempixel.com/640/480/city,9,Sit voluptas impedit doloribus aut.
3069,214,http://lorempixel.com/640/480/city,10,Dolore autem quod iste voluptatibus.
3070,214,http://lorempixel.com/640/480/city,11,Ut et qui ab ea.
3071,214,http://lorempixel.com/640/480/city,12,Quas ad quo voluptas alias.
3072,214,http://lorempixel.com/640/480/city,13,Earum ut libero qui voluptatem.
3073,214,http://lorempixel.com/640/480/city,14,Delectus accusamus numquam sed officia.
3074,214,http://lorempixel.com/640/480/city,15,Quos suscipit nobis beatae dolor.
3075,214,http://lorempixel.com/640/480/city,16,Qui ipsum eaque deleniti ad.
3076,214,http://lorempixel.com/640/480/city,17,Ut iste dignissimos rem rem.
3077,214,http://lorempixel.com/640/480/city,18,Quia deserunt est dolor deleniti.
3078,214,http://lorempixel.com/640/480/city,19,Eos ut ut excepturi perspiciatis.
3079,214,http://lorempixel.com/640/480/city,20,Ut est dignissimos omnis similique.
3080,214,http://lorempixel.com/640/480/city,21,Esse aut porro porro explicabo.
3081,214,http://lorempixel.com/640/480/city,22,Nulla et modi quasi ducimus.
3082,214,http://lorempixel.com/640/480/city,23,Quod voluptates et ut et.
3083,214,http://lorempixel.com/640/480/city,24,Iure dolore autem iste et.
3084,215,http://lorempixel.com/640/480/city,0,Eum iusto non ut iste.
3085,215,http://lorempixel.com/640/480/city,1,Modi dolorum delectus debitis voluptates.
3086,215,http://lorempixel.com/640/480/city,2,Sit et illum maiores modi.
3087,215,http://lorempixel.com/640/480/city,3,Sunt et quod doloribus est.
3088,215,http://lorempixel.com/640/480/city,4,Ex similique voluptatem aut nam.
3089,215,http://lorempixel.com/640/480/city,5,Officiis aut voluptatibus nisi necessitatibus.
3090,215,http://lorempixel.com/640/480/city,6,Corporis consectetur at fugit aliquam.
3091,215,http://lorempixel.com/640/480/city,7,Sequi assumenda qui nihil quod.
3092,215,http://lorempixel.com/640/480/city,8,Sit dolorum deleniti quia dolor.
3093,215,http://lorempixel.com/640/480/city,9,Deserunt aliquam quod ratione non.
3094,215,http://lorempixel.com/640/480/city,10,Qui non est laboriosam vitae.
3095,215,http://lorempixel.com/640/480/city,11,Tenetur consectetur dolore necessitatibus autem.
3096,215,http://lorempixel.com/640/480/city,12,Sunt maxime nobis omnis magni.
3097,215,http://lorempixel.com/640/480/city,13,Unde eos quibusdam asperiores harum.
3098,215,http://lorempixel.com/640/480/city,14,Repudiandae voluptate perferendis rerum consectetur.
3099,215,http://lorempixel.com/640/480/city,15,Perferendis sapiente optio aspernatur dolore.
3100,215,http://lorempixel.com/640/480/city,16,Quia tenetur placeat et temporibus.
3101,215,http://lorempixel.com/640/480/city,17,Nam et aut id ut.
3102,215,http://lorempixel.com/640/480/city,18,Illum et vel vel accusantium.
3103,215,http://lorempixel.com/640/480/city,19,Sit quis quidem quos quia.
3104,215,http://lorempixel.com/640/480/city,20,Ut expedita impedit incidunt et.
3105,215,http://lorempixel.com/640/480/city,21,Veniam qui aliquid ipsam labore.
3106,215,http://lorempixel.com/640/480/city,22,Vel tempora dolorem et alias.
3107,215,http://lorempixel.com/640/480/city,23,Aut rerum aut debitis sit.
3108,215,http://lorempixel.com/640/480/city,24,Eos exercitationem similique voluptatem voluptate.
3109,215,http://lorempixel.com/640/480/city,25,Quibusdam vero labore corrupti magnam.
3110,215,http://lorempixel.com/640/480/city,26,Sed nesciunt natus est est.
3111,215,http://lorempixel.com/640/480/city,27,Velit ex et natus corrupti.
3112,215,http://lorempixel.com/640/480/city,28,Sunt tenetur ipsam sed assumenda.
3113,216,http://lorempixel.com/640/480/city,0,Rem illum recusandae aut aperiam.
3114,216,http://lorempixel.com/640/480/city,1,Dolores ut sed culpa perspiciatis.
3115,216,http://lorempixel.com/640/480/city,2,Et sapiente occaecati labore et.
3116,216,http://lorempixel.com/640/480/city,3,Quibusdam itaque dolore repudiandae quia.
3117,216,http://lorempixel.com/640/480/city,4,Sapiente dolorem libero est beatae.
3118,216,http://lorempixel.com/640/480/city,5,Omnis voluptatem qui suscipit adipisci.
3119,216,http://lorempixel.com/640/480/city,6,Repellat minima eligendi accusantium mollitia.
3120,216,http://lorempixel.com/640/480/city,7,Soluta repellat eius et sed.
3121,216,http://lorempixel.com/640/480/city,8,Aut architecto quia sint modi.
3122,216,http://lorempixel.com/640/480/city,9,Quo temporibus facere perspiciatis est.
3123,216,http://lorempixel.com/640/480/city,10,Similique temporibus eos libero reprehenderit.
3124,216,http://lorempixel.com/640/480/city,11,Sit et sit provident ratione.
3125,216,http://lorempixel.com/640/480/city,12,Quia illo sapiente animi omnis.
3126,216,http://lorempixel.com/640/480/city,13,Veritatis omnis laudantium sit mollitia.
3127,216,http://lorempixel.com/640/480/city,14,Est et maxime consequatur amet.
3128,216,http://lorempixel.com/640/480/city,15,Vel impedit quas et eligendi.
3129,216,http://lorempixel.com/640/480/city,16,Magnam rerum saepe qui beatae.
3130,217,http://lorempixel.com/640/480/city,0,Minima quod tempore cupiditate ut.
3131,217,http://lorempixel.com/640/480/city,1,Dolore placeat nisi sequi impedit.
3132,217,http://lorempixel.com/640/480/city,2,Optio et in ut nihil.
3133,217,http://lorempixel.com/640/480/city,3,Dicta ipsam repudiandae est aut.
3134,217,http://lorempixel.com/640/480/city,4,Et amet nulla ullam corporis.
3135,217,http://lorempixel.com/640/480/city,5,Voluptatem sit non aliquam eveniet.
3136,217,http://lorempixel.com/640/480/city,6,Sit harum nostrum sed provident.
3137,217,http://lorempixel.com/640/480/city,7,Velit esse minima rerum praesentium.
3138,217,http://lorempixel.com/640/480/city,8,Occaecati praesentium iusto velit enim.
3139,217,http://lorempixel.com/640/480/city,9,Ea et deleniti quibusdam possimus.
3140,217,http://lorempixel.com/640/480/city,10,Officiis minima et eveniet consequatur.
3141,217,http://lorempixel.com/640/480/city,11,Reprehenderit porro quisquam minus et.
3142,217,http://lorempixel.com/640/480/city,12,Saepe quos aspernatur perferendis magni.
3143,217,http://lorempixel.com/640/480/city,13,Placeat omnis rerum porro id.
3144,217,http://lorempixel.com/640/480/city,14,Qui ipsam adipisci dolorem sit.
3145,218,http://lorempixel.com/640/480/city,0,Distinctio voluptatum odio itaque a.
3146,218,http://lorempixel.com/640/480/city,1,Earum ea fuga consectetur deserunt.
3147,218,http://lorempixel.com/640/480/city,2,Atque qui minima fugiat et.
3148,218,http://lorempixel.com/640/480/city,3,Et deleniti ut quaerat est.
3149,218,http://lorempixel.com/640/480/city,4,Aut tempore dicta voluptatem earum.
3150,218,http://lorempixel.com/640/480/city,5,Non adipisci sapiente expedita qui.
3151,218,http://lorempixel.com/640/480/city,6,Rerum odio et voluptatem voluptatem.
3152,218,http://lorempixel.com/640/480/city,7,Fuga ut necessitatibus cum quia.
3153,218,http://lorempixel.com/640/480/city,8,Omnis delectus et dolorem quod.
3154,218,http://lorempixel.com/640/480/city,9,Iure molestiae corporis sit dignissimos.
3155,218,http://lorempixel.com/640/480/city,10,Aspernatur illum pariatur nulla tempore.
3156,218,http://lorempixel.com/640/480/city,11,Unde voluptatem sed id eius.
3157,218,http://lorempixel.com/640/480/city,12,Enim sapiente aliquam dolores corrupti.
3158,219,http://lorempixel.com/640/480/city,0,Assumenda qui ullam tempore numquam.
3159,219,http://lorempixel.com/640/480/city,1,Dolor omnis qui sed nesciunt.
3160,219,http://lorempixel.com/640/480/city,2,Et cupiditate optio qui ut.
3161,219,http://lorempixel.com/640/480/city,3,Iusto velit dolorem sapiente enim.
3162,219,http://lorempixel.com/640/480/city,4,Et maiores et perspiciatis praesentium.
3163,220,http://lorempixel.com/640/480/city,0,Harum consequatur sit aut tempora.
3164,220,http://lorempixel.com/640/480/city,1,Placeat et odio odit et.
3165,221,http://lorempixel.com/640/480/city,0,Qui officiis minus inventore quia.
3166,221,http://lorempixel.com/640/480/city,1,Sunt expedita vel soluta repudiandae.
3167,221,http://lorempixel.com/640/480/city,2,Voluptas et illum quos nemo.
3168,221,http://lorempixel.com/640/480/city,3,Rem enim minima et quia.
3169,221,http://lorempixel.com/640/480/city,4,Perspiciatis ut repellat et ex.
3170,221,http://lorempixel.com/640/480/city,5,Enim necessitatibus sapiente sequi aliquid.
3171,221,http://lorempixel.com/640/480/city,6,Autem sit ea eaque harum.
3172,221,http://lorempixel.com/640/480/city,7,Autem exercitationem impedit adipisci nemo.
3173,221,http://lorempixel.com/640/480/city,8,Omnis voluptate dicta quis laudantium.
3174,221,http://lorempixel.com/640/480/city,9,Deleniti atque in voluptate quis.
3175,221,http://lorempixel.com/640/480/city,10,Tempora enim odio nostrum dolor.
3176,222,http://lorempixel.com/640/480/city,0,Accusamus doloribus odit saepe odit.
3177,222,http://lorempixel.com/640/480/city,1,Architecto est modi vel at.
3178,222,http://lorempixel.com/640/480/city,2,Dolores velit omnis expedita aut.
3179,222,http://lorempixel.com/640/480/city,3,Exercitationem aut est non non.
3180,222,http://lorempixel.com/640/480/city,4,Et mollitia ex itaque quis.
3181,222,http://lorempixel.com/640/480/city,5,Aliquid quod ipsam quis sint.
3182,222,http://lorempixel.com/640/480/city,6,Laboriosam dolorum qui quia ut.
3183,222,http://lorempixel.com/640/480/city,7,Alias et eum explicabo ad.
3184,222,http://lorempixel.com/640/480/city,8,Aut corrupti adipisci dolorem voluptas.
3185,222,http://lorempixel.com/640/480/city,9,Doloremque blanditiis numquam excepturi consequuntur.
3186,222,http://lorempixel.com/640/480/city,10,Eligendi dolorem quibusdam ducimus ex.
3187,222,http://lorempixel.com/640/480/city,11,Qui dolorem eos qui sint.
3188,223,http://lorempixel.com/640/480/city,0,Aut ut sapiente ut aut.
3189,223,http://lorempixel.com/640/480/city,1,Nihil modi reiciendis exercitationem quam.
3190,223,http://lorempixel.com/640/480/city,2,Quia est aut et ut.
3191,223,http://lorempixel.com/640/480/city,3,Numquam ullam ab vel hic.
3192,223,http://lorempixel.com/640/480/city,4,Ratione quo vero rem id.
3193,223,http://lorempixel.com/640/480/city,5,Et perspiciatis ex inventore voluptatem.
3194,223,http://lorempixel.com/640/480/city,6,Eaque ipsa placeat quas saepe.
3195,223,http://lorempixel.com/640/480/city,7,Officia laboriosam delectus porro possimus.
3196,223,http://lorempixel.com/640/480/city,8,Velit non maxime libero ipsum.
3197,223,http://lorempixel.com/640/480/city,9,Est asperiores necessitatibus vel magni.
3198,223,http://lorempixel.com/640/480/city,10,Placeat adipisci sunt ipsum ipsum.
3199,223,http://lorempixel.com/640/480/city,11,Ratione ex nulla et saepe.
3200,223,http://lorempixel.com/640/480/city,12,Officia est accusamus beatae itaque.
3201,223,http://lorempixel.com/640/480/city,13,Vitae iure ullam id velit.
3202,223,http://lorempixel.com/640/480/city,14,Possimus ut sed fugit nostrum.
3203,223,http://lorempixel.com/640/480/city,15,Unde est incidunt consectetur pariatur.
3204,224,http://lorempixel.com/640/480/city,0,Doloribus id mollitia omnis veritatis.
3205,224,http://lorempixel.com/640/480/city,1,Autem voluptatum fuga sed ut.
3206,224,http://lorempixel.com/640/480/city,2,Corrupti non suscipit minus quod.
3207,224,http://lorempixel.com/640/480/city,3,Culpa placeat officiis reiciendis facere.
3208,224,http://lorempixel.com/640/480/city,4,Quas et aliquid autem sapiente.
3209,224,http://lorempixel.com/640/480/city,5,Aut ut dolore ut facere.
3210,224,http://lorempixel.com/640/480/city,6,Molestiae ad magnam eligendi est.
3211,224,http://lorempixel.com/640/480/city,7,Odit dignissimos animi iste facilis.
3212,224,http://lorempixel.com/640/480/city,8,Reprehenderit est ducimus doloribus quia.
3213,224,http://lorempixel.com/640/480/city,9,Fuga harum dignissimos aspernatur quibusdam.
3214,224,http://lorempixel.com/640/480/city,10,Porro aut inventore ipsa sint.
3215,226,http://lorempixel.com/640/480/city,0,Blanditiis et sit doloremque molestias.
3216,226,http://lorempixel.com/640/480/city,1,Quibusdam deleniti harum iure veritatis.
3217,226,http://lorempixel.com/640/480/city,2,Maiores enim vitae praesentium ea.
3218,226,http://lorempixel.com/640/480/city,3,Expedita itaque illo deserunt omnis.
3219,226,http://lorempixel.com/640/480/city,4,Eum quia voluptas rerum sunt.
3220,226,http://lorempixel.com/640/480/city,5,Aut voluptatem aliquid delectus corporis.
3221,226,http://lorempixel.com/640/480/city,6,Blanditiis animi ipsa dolorem repellendus.
3222,227,http://lorempixel.com/640/480/city,0,Aut corrupti nobis aliquid eaque.
3223,227,http://lorempixel.com/640/480/city,1,Reprehenderit omnis quo quia natus.
3224,227,http://lorempixel.com/640/480/city,2,Vitae vitae porro sed atque.
