_id,listing_id,photo_url,priority,caption
1,1,http://lorempixel.com/640/480/city,0,Tenetur est tempora quia dolorem.
2,1,http://lorempixel.com/640/480/city,1,Et reiciendis dignissimos aut occaecati.
3,1,http://lorempixel.com/640/480/city,2,Eveniet labore est aperiam culpa.
4,1,http://lorempixel.com/640/480/city,3,Eum soluta aliquam nam nulla.
5,1,http://lorempixel.com/640/480/city,4,Magnam quo cupiditate architecto porro.
6,1,http://lorempixel.com/640/480/city,5,Ipsum perspiciatis voluptatem numquam consectetur.
7,1,http://lorempixel.com/640/480/city,6,Facere ut error vel eos.
8,1,http://lorempixel.com/640/480/city,7,Adipisci rerum rerum asperiores incidunt.
9,1,http://lorempixel.com/640/480/city,8,Impedit neque vel praesentium aut.
10,1,http://lorempixel.com/640/480/city,9,Id porro maxime et enim.
11,1,http://lorempixel.com/640/480/city,10,Illum quod et qui doloribus.
12,1,http://lorempixel.com/640/480/city,11,Qui aut dicta dignissimos consectetur.
13,1,http://lorempixel.com/640/480/city,12,Sunt atque ipsa dolorum ullam.
14,1,http://lorempixel.com/640/480/city,13,Animi iste modi in recusandae.
15,1,http://lorempixel.com/640/480/city,14,Molestiae dignissimos quo exercitationem dolor.
16,1,http://lorempixel.com/640/480/city,15,Et asperiores voluptatibus modi quos.
17,1,http://lorempixel.com/640/480/city,16,Nemo pariatur velit ut explicabo.
18,1,http://lorempixel.com/640/480/city,17,Eaque consequatur optio voluptatum non.
19,1,http://lorempixel.com/640/480/city,18,Omnis exercitationem sint atque nulla.
20,1,http://lorempixel.com/640/480/city,19,Quibusdam quibusdam maiores voluptatibus enim.
21,1,http://lorempixel.com/640/480/city,20,Nobis dolor autem doloribus ea.
22,1,http://lorempixel.com/640/480/city,21,Tenetur sint non facere ut.
23,1,http://lorempixel.com/640/480/city,22,Qui et expedita eius sequi.
24,1,http://lorempixel.com/640/480/city,23,Commodi nihil nesciunt sequi debitis.
25,1,http://lorempixel.com/640/480/city,24,Eveniet quas eveniet molestiae molestiae.
26,2,http://lorempixel.com/640/480/city,0,Et in est perferendis qui.
27,2,http://lorempixel.com/640/480/city,1,Quia et magni et dolor.
28,2,http://lorempixel.com/640/480/city,2,Consequuntur ratione eaque non sed.
29,2,http://lorempixel.com/640/480/city,3,Dolor quo dolores repellat voluptas.
30,2,http://lorempixel.com/640/480/city,4,Ipsum qui et architecto et.
31,2,http://lorempixel.com/640/480/city,5,Non aut error consequuntur facere.
32,2,http://lorempixel.com/640/480/city,6,Totam eum molestiae aut dolorem.
33,2,http://lorempixel.com/640/480/city,7,Autem velit veniam pariatur itaque.
34,3,http://lorempixel.com/640/480/city,0,Consequatur repellat blanditiis sit ratione.
35,3,http://lorempixel.com/640/480/city,1,Illum voluptate vel rerum et.
36,3,http://lorempixel.com/640/480/city,2,Sapiente temporibus esse reiciendis consectetur.
37,4,http://lorempixel.com/640/480/city,0,Et magni corporis sapiente doloribus.
38,4,http://lorempixel.com/640/480/city,1,Dolore consequatur non impedit corporis.
39,4,http://lorempixel.com/640/480/city,2,Aut dolor quisquam aliquam quo.
40,4,http://lorempixel.com/640/480/city,3,Ut aut eius aut est.
41,4,http://lorempixel.com/640/480/city,4,Officiis sunt odio temporibus pariatur.
42,4,http://lorempixel.com/640/480/city,5,Esse suscipit assumenda cupiditate ut.
43,5,http://lorempixel.com/640/480/city,0,Vel doloremque voluptates labore eaque.
44,5,http://lorempixel.com/640/480/city,1,Cumque non consequatur similique omnis.
45,5,http://lorempixel.com/640/480/city,2,Quidem quae consequatur sit harum.
46,5,http://lorempixel.com/640/480/city,3,Dolorum neque deleniti culpa animi.
47,5,http://lorempixel.com/640/480/city,4,Corporis quia quis explicabo odit.
48,5,http://lorempixel.com/640/480/city,5,Facere consequatur quam et voluptatem.
49,6,http://lorempixel.com/640/480/city,0,Quia ut vero necessitatibus deleniti.
50,6,http://lorempixel.com/640/480/city,1,Sit qui doloremque dignissimos sit.
51,6,http://lorempixel.com/640/480/city,2,Rerum dolorem non qui molestiae.
52,6,http://lorempixel.com/640/480/city,3,Fuga numquam recusandae et deserunt.
53,8,http://lorempixel.com/640/480/city,0,Iure fugiat labore sed officiis.
54,8,http://lorempixel.com/640/480/city,1,Reiciendis aut nihil doloremque eaque.
55,8,http://lorempixel.com/640/480/city,2,Voluptas blanditiis earum perferendis culpa.
56,8,http://lorempixel.com/640/480/city,3,Vel ea dolores quasi voluptatem.
57,8,http://lorempixel.com/640/480/city,4,Et eum ut dolor possimus.
58,8,http://lorempixel.com/640/480/city,5,Natus voluptatem esse sed quia.
59,8,http://lorempixel.com/640/480/city,6,Quod ut molestiae nemo adipisci.
60,8,http://lorempixel.com/640/480/city,7,Id pariatur molestiae repellat modi.
61,9,http://lorempixel.com/640/480/city,0,Saepe deleniti consequatur quasi delectus.
62,9,http://lorempixel.com/640/480/city,1,Pariatur vero et nostrum in.
63,9,http://lorempixel.com/640/480/city,2,Et soluta ad sit qui.
64,9,http://lorempixel.com/640/480/city,3,Vero qui consequuntur est consequatur.
65,10,http://lorempixel.com/640/480/city,0,Iste qui delectus et voluptas.
66,10,http://lorempixel.com/640/480/city,1,Voluptatem maiores veritatis veritatis quis.
67,10,http://lorempixel.com/640/480/city,2,Eligendi saepe ut qui nostrum.
68,10,http://lorempixel.com/640/480/city,3,Reiciendis est voluptates nihil quia.
69,10,http://lorempixel.com/640/480/city,4,Nostrum et culpa qui vitae.
70,10,http://lorempixel.com/640/480/city,5,Blanditiis earum exercitationem rerum numquam.
71,10,http://lorempixel.com/640/480/city,6,Aspernatur perspiciatis voluptatum incidunt totam.
72,10,http://lorempixel.com/640/480/city,7,Voluptatem aut aut incidunt reprehenderit.
73,10,http://lorempixel.com/640/480/city,8,Culpa sunt et reiciendis non.
74,10,http://lorempixel.com/640/480/city,9,Quo provident praesentium qui ullam.
75,10,http://lorempixel.com/640/480/city,10,Eum voluptatem nisi tempore reprehenderit.
76,10,http://lorempixel.com/640/480/city,11,Sit deserunt occaecati iusto quidem.
77,10,http://lorempixel.com/640/480/city,12,Magnam commodi tenetur officia hic.
78,10,http://lorempixel.com/640/480/city,13,Et et dignissimos commodi atque.
79,10,http://lorempixel.com/640/480/city,14,Nesciunt modi aut ratione vel.
80,10,http://lorempixel.com/640/480/city,15,Officiis voluptatem praesentium quaerat et.
81,10,http://lorempixel.com/640/480/city,16,Delectus qui molestiae sed eligendi.
82,10,http://lorempixel.com/640/480/city,17,Ut distinctio deleniti suscipit temporibus.
83,10,http://lorempixel.com/640/480/city,18,Omnis at debitis nesciunt ad.
84,11,http://lorempixel.com/640/480/city,0,Dicta quos dolorem expedita numquam.
85,11,http://lorempixel.com/640/480/city,1,Doloribus recusandae minima assumenda dolorum.
86,11,http://lorempixel.com/640/480/city,2,Accusamus voluptatum animi aliquid eum.
87,11,http://lorempixel.com/640/480/city,3,Et deserunt id tempora cupiditate.
88,11,http://lorempixel.com/640/480/city,4,Quaerat dolorem praesentium earum eos.
89,11,http://lorempixel.com/640/480/city,5,Quo sed iure eius aut.
90,11,http://lorempixel.com/640/480/city,6,Blanditiis est qui id qui.
91,11,http://lorempixel.com/640/480/city,7,Libero mollitia praesentium ducimus et.
92,11,http://lorempixel.com/640/480/city,8,Quasi tempora et sunt fugit.
93,11,http://lorempixel.com/640/480/city,9,Dolorem expedita tempora beatae et.
94,11,http://lorempixel.com/640/480/city,10,Repudiandae enim placeat numquam deserunt.
95,11,http://lorempixel.com/640/480/city,11,Sapiente esse dicta delectus nihil.
96,11,http://lorempixel.com/640/480/city,12,Sapiente est aut possimus deserunt.
97,11,http://lorempixel.com/640/480/city,13,Sint exercitationem vitae autem accusamus.
98,11,http://lorempixel.com/640/480/city,14,Molestiae dolores est architecto omnis.
99,11,http://lorempixel.com/640/480/city,15,Quaerat eaque ab et mollitia.
100,11,http://lorempixel.com/640/480/city,16,Ut est aut et sunt.
101,11,http://lorempixel.com/640/480/city,17,Sed eaque non et magnam.
102,11,http://lorempixel.com/640/480/city,18,Cupiditate optio id ratione illum.
103,11,http://lorempixel.com/640/480/city,19,Debitis cumque esse velit ratione.
104,11,http://lorempixel.com/640/480/city,20,Sint et consequuntur eos dolores.
105,11,http://lorempixel.com/640/480/city,21,Et hic repellat ea aspernatur.
106,11,http://lorempixel.com/640/480/city,22,Rem et vel rerum deserunt.
107,11,http://lorempixel.com/640/480/city,23,Dolorum officia repudiandae numquam dolorem.
108,11,http://lorempixel.com/640/480/city,24,Accusantium deserunt quae aut est.
109,11,http://lorempixel.com/640/480/city,25,Iure doloremque et molestias beatae.
110,12,http://lorempixel.com/640/480/city,0,Et possimus odio nihil fugiat.
111,12,http://lorempixel.com/640/480/city,1,Aut dolorum error ut est.
112,12,http://lorempixel.com/640/480/city,2,Dolore amet odit placeat recusandae.
113,12,http://lorempixel.com/640/480/city,3,Quidem suscipit aut nesciunt est.
114,12,http://lorempixel.com/640/480/city,4,In quis placeat consequatur ipsum.
115,12,http://lorempixel.com/640/480/city,5,Veniam cumque et minus quasi.
116,12,http://lorempixel.com/640/480/city,6,Esse iusto in natus quis.
117,12,http://lorempixel.com/640/480/city,7,Corporis facere voluptates facilis omnis.
118,12,http://lorempixel.com/640/480/city,8,Voluptatem quas in aut voluptas.
119,12,http://lorempixel.com/640/480/city,9,Qui ullam sunt debitis ut.
120,12,http://lorempixel.com/640/480/city,10,Ratione sunt porro consequatur id.
121,12,http://lorempixel.com/640/480/city,11,Doloribus dolore dolore optio ut.
122,12,http://lorempixel.com/640/480/city,12,Praesentium iusto ab est enim.
123,12,http://lorempixel.com/640/480/city,13,Quo ratione at optio modi.
124,12,http://lorempixel.com/640/480/city,14,Rerum autem omnis ut inventore.
125,12,http://lorempixel.com/640/480/city,15,Sed et recusandae aliquam laudantium.
126,12,http://lorempixel.com/640/480/city,16,Aut sed et fugit rerum.
127,12,http://lorempixel.com/640/480/city,17,Neque non et animi maiores.
128,12,http://lorempixel.com/640/480/city,18,Nostrum aspernatur iusto necessitatibus cum.
129,12,http://lorempixel.com/640/480/city,19,Velit fugit veritatis natus laboriosam.
130,12,http://lorempixel.com/640/480/city,20,Sit consectetur ut consequatur dolorem.
131,12,http://lorempixel.com/640/480/city,21,Quia consequatur quia possimus magni.
132,12,http://lorempixel.com/640/480/city,22,Ut fuga eos repudiandae cupiditate.
133,12,http://lorempixel.com/640/480/city,23,Similique consectetur numquam at temporibus.
134,12,http://lorempixel.com/640/480/city,24,Non ea velit deleniti impedit.
135,12,http://lorempixel.com/640/480/city,25,Eum ab eos rerum totam.
136,12,http://lorempixel.com/640/480/city,26,Dolores sit rem quae consequatur.
137,12,http://lorempixel.com/640/480/city,27,Doloribus unde aut sunt numquam.
138,13,http://lorempixel.com/640/480/city,0,Eveniet et praesentium nobis officia.
139,13,http://lorempixel.com/640/480/city,1,Ut quis ut ad laboriosam.
140,13,http://lorempixel.com/640/480/city,2,Sed quis enim blanditiis sit.
141,13,http://lorempixel.com/640/480/city,3,Similique libero temporibus accusantium necessitatibus.
142,13,http://lorempixel.com/640/480/city,4,Quidem qui repellendus enim quas.
143,13,http://lorempixel.com/640/480/city,5,Et omnis laboriosam perferendis dolore.
144,14,http://lorempixel.com/640/480/city,0,Sequi rem unde perferendis velit.
145,14,http://lorempixel.com/640/480/city,1,Reiciendis veniam neque accusantium deserunt.
146,14,http://lorempixel.com/640/480/city,2,Iste in magnam veritatis non.
147,15,http://lorempixel.com/640/480/city,0,Temporibus tempora aliquid nesciunt delectus.
148,15,http://lorempixel.com/640/480/city,1,Amet quia et omnis tempore.
149,15,http://lorempixel.com/640/480/city,2,Omnis unde ut a minima.
150,15,http://lorempixel.com/640/480/city,3,Praesentium sunt eaque consectetur voluptates.
151,15,http://lorempixel.com/640/480/city,4,Est voluptatem quo delectus ipsa.
152,15,http://lorempixel.com/640/480/city,5,Et nihil qui aspernatur non.
153,15,http://lorempixel.com/640/480/city,6,Nisi quidem iste quaerat ut.
154,15,http://lorempixel.com/640/480/city,7,Quae ut ad incidunt consequatur.
155,15,http://lorempixel.com/640/480/city,8,Enim quisquam eaque natus rem.
156,15,http://lorempixel.com/640/480/city,9,Molestias provident mollitia qui nisi.
157,15,http://lorempixel.com/640/480/city,10,Assumenda aperiam voluptatem quibusdam minus.
158,15,http://lorempixel.com/640/480/city,11,Fugit est itaque iusto distinctio.
159,15,http://lorempixel.com/640/480/city,12,Dolor corrupti molestiae saepe velit.
160,15,http://lorempixel.com/640/480/city,13,Architecto ipsum quam sint exercitationem.
161,15,http://lorempixel.com/640/480/city,14,Fugiat est quas maxime distinctio.
162,15,http://lorempixel.com/640/480/city,15,Ipsam exercitationem asperiores rerum qui.
163,15,http://lorempixel.com/640/480/city,16,Architecto est vero ut minima.
164,15,http://lorempixel.com/640/480/city,17,Dicta libero quas omnis aut.
165,15,http://lorempixel.com/640/480/city,18,Commodi ut expedita consequuntur alias.
166,15,http://lorempixel.com/640/480/city,19,Tempore laudantium minima reprehenderit ut.
167,15,http://lorempixel.com/640/480/city,20,Enim sunt dolorem itaque voluptas.
168,15,http://lorempixel.com/640/480/city,21,Vel sapiente omnis dignissimos magni.
169,15,http://lorempixel.com/640/480/city,22,Reprehenderit maiores aspernatur ea soluta.
170,15,http://lorempixel.com/640/480/city,23,Sed voluptatibus tempore nisi praesentium.
171,15,http://lorempixel.com/640/480/city,24,Sequi natus impedit dolorem ab.
172,15,http://lorempixel.com/640/480/city,25,Omnis vitae occaecati eligendi voluptas.
173,15,http://lorempixel.com/640/480/city,26,Ea consectetur ea autem sit.
174,15,http://lorempixel.com/640/480/city,27,Occaecati fugiat quod accusantium laborum.
175,15,http://lorempixel.com/640/480/city,28,Laborum amet quos reiciendis maxime.
176,16,http://lorempixel.com/640/480/city,0,Excepturi ea quo temporibus cumque.
177,16,http://lorempixel.com/640/480/city,1,Aut beatae veritatis ea et.
178,16,http://lorempixel.com/640/480/city,2,In veritatis sed velit animi.
179,16,http://lorempixel.com/640/480/city,3,Voluptate accusantium mollitia eum blanditiis.
180,16,http://lorempixel.com/640/480/city,4,Molestiae nemo cum id labore.
181,16,http://lorempixel.com/640/480/city,5,Consequatur ipsam dicta vel voluptas.
182,16,http://lorempixel.com/640/480/city,6,Et amet aliquam iste laboriosam.
183,16,http://lorempixel.com/640/480/city,7,Numquam cupiditate sunt quod assumenda.
184,16,http://lorempixel.com/640/480/city,8,Sed omnis quas aperiam aperiam.
185,16,http://lorempixel.com/640/480/city,9,Dolore culpa amet recusandae nemo.
186,16,http://lorempixel.com/640/480/city,10,Et eaque officia eos architecto.
187,16,http://lorempixel.com/640/480/city,11,Labore optio officiis corrupti a.
188,16,http://lorempixel.com/640/480/city,12,Sit molestias vel facere temporibus.
189,16,http://lorempixel.com/640/480/city,13,Necessitatibus itaque aut laboriosam autem.
190,16,http://lorempixel.com/640/480/city,14,Ut distinctio excepturi quis pariatur.
191,16,http://lorempixel.com/640/480/city,15,Tenetur tenetur qui eos ut.
192,16,http://lorempixel.com/640/480/city,16,Voluptates commodi non amet dicta.
193,16,http://lorempixel.com/640/480/city,17,Nam eligendi officia sapiente laudantium.
194,16,http://lorempixel.com/640/480/city,18,Corrupti quod molestiae aut eos.
195,16,http://lorempixel.com/640/480/city,19,Asperiores illum veritatis sunt nihil.
196,16,http://lorempixel.com/640/480/city,20,Aut animi corporis et quia.
197,16,http://lorempixel.com/640/480/city,21,Nulla quibusdam iure ipsa consectetur.
198,16,http://lorempixel.com/640/480/city,22,Ut tenetur voluptatem consectetur hic.
199,16,http://lorempixel.com/640/480/city,23,Nihil labore illo ut quaerat.
200,16,http://lorempixel.com/640/480/city,24,Magnam a assumenda qui animi.
201,16,http://lorempixel.com/640/480/city,25,Omnis occaecati optio non et.
202,16,http://lorempixel.com/640/480/city,26,Rerum qui voluptates porro sunt.
203,18,http://lorempixel.com/640/480/city,0,Maxime odit laudantium consectetur temporibus.
204,18,http://lorempixel.com/640/480/city,1,Recusandae quo enim perspiciatis ratione.
205,18,http://lorempixel.com/640/480/city,2,Accusamus sit labore tenetur officiis.
206,18,http://lorempixel.com/640/480/city,3,Nihil a delectus inventore autem.
207,18,http://lorempixel.com/640/480/city,4,Voluptatibus nihil dolores dolore et.
208,18,http://lorempixel.com/640/480/city,5,Eaque nihil fugit sed consequatur.
209,18,http://lorempixel.com/640/480/city,6,Aut commodi molestiae tenetur dolor.
210,18,http://lorempixel.com/640/480/city,7,Ut quis doloremque fugit voluptatem.
211,18,http://lorempixel.com/640/480/city,8,Qui molestiae voluptatem laboriosam qui.
212,18,http://lorempixel.com/640/480/city,9,Quo non ut aut cum.
213,18,http://lorempixel.com/640/480/city,10,Esse officia dicta aut aut.
214,18,http://lorempixel.com/640/480/city,11,Laboriosam similique suscipit iusto aliquid.
215,18,http://lorempixel.com/640/480/city,12,Rerum eveniet omnis doloremque similique.
216,18,http://lorempixel.com/640/480/city,13,Aut dolorum dolorem ut nulla.
217,18,http://lorempixel.com/640/480/city,14,Doloremque iusto corrupti necessitatibus voluptatum.
218,18,http://lorempixel.com/640/480/city,15,Natus ad et sunt debitis.
219,18,http://lorempixel.com/640/480/city,16,Quia nam et labore ut.
220,18,http://lorempixel.com/640/480/city,17,Quo maxime qui rem et.
221,18,http://lorempixel.com/640/480/city,18,Qui sunt a nemo maxime.
222,18,http://lorempixel.com/640/480/city,19,Quo illum soluta eos perspiciatis.
223,18,http://lorempixel.com/640/480/city,20,Enim ipsum dolorem iure illum.
224,18,http://lorempixel.com/640/480/city,21,Quis quo omnis qui et.
225,18,http://lorempixel.com/640/480/city,22,Esse cupiditate quis praesentium reprehenderit.
226,18,http://lorempixel.com/640/480/city,23,Sed porro commodi aut error.
227,18,http://lorempixel.com/640/480/city,24,Dolor non quia illum laboriosam.
228,19,http://lorempixel.com/640/480/city,0,Quidem fugit quia mollitia est.
229,19,http://lorempixel.com/640/480/city,1,At sed odit sit qui.
230,19,http://lorempixel.com/640/480/city,2,Dolorem quasi aperiam repellat eaque.
231,19,http://lorempixel.com/640/480/city,3,Non itaque tempora odio ut.
232,19,http://lorempixel.com/640/480/city,4,Rerum voluptatem repellat ex aliquid.
233,19,http://lorempixel.com/640/480/city,5,Exercitationem cumque quae rerum iure.
234,19,http://lorempixel.com/640/480/city,6,Consequatur ullam illum ex repudiandae.
235,19,http://lorempixel.com/640/480/city,7,Molestiae eum pariatur ullam voluptates.
236,19,http://lorempixel.com/640/480/city,8,Qui est eveniet magnam numquam.
237,19,http://lorempixel.com/640/480/city,9,Animi aut non consequatur vero.
238,19,http://lorempixel.com/640/480/city,10,Nulla in dignissimos illo natus.
239,19,http://lorempixel.com/640/480/city,11,Est quidem nobis ratione explicabo.
240,19,http://lorempixel.com/640/480/city,12,Dolore consectetur et qui quisquam.
241,19,http://lorempixel.com/640/480/city,13,Temporibus dolor ipsam qui ex.
242,19,http://lorempixel.com/640/480/city,14,Saepe deleniti et ipsum pariatur.
243,19,http://lorempixel.com/640/480/city,15,Quasi neque quis quia ducimus.
244,19,http://lorempixel.com/640/480/city,16,Corrupti repellendus animi est et.
245,19,http://lorempixel.com/640/480/city,17,Voluptas atque et iste voluptas.
246,19,http://lorempixel.com/640/480/city,18,Aut est inventore laborum et.
247,19,http://lorempixel.com/640/480/city,19,Modi eos amet vel pariatur.
248,19,http://lorempixel.com/640/480/city,20,In fuga beatae et aut.
249,19,http://lorempixel.com/640/480/city,21,Qui in voluptatibus praesentium laboriosam.
250,19,http://lorempixel.com/640/480/city,22,Porro magnam delectus eum vitae.
251,19,http://lorempixel.com/640/480/city,23,Nesciunt aut eveniet esse quis.
252,19,http://lorempixel.com/640/480/city,24,Neque vel consequatur quos explicabo.
253,19,http://lorempixel.com/640/480/city,25,Ut doloremque dolores saepe corrupti.
254,19,http://lorempixel.com/640/480/city,26,Sed officia eum molestiae quaerat.
255,19,http://lorempixel.com/640/480/city,27,Fuga repellendus laudantium nemo est.
256,19,http://lorempixel.com/640/480/city,28,Ut voluptates voluptatem voluptas doloremque.
257,20,http://lorempixel.com/640/480/city,0,Labore eos autem fugit dolorem.
258,21,http://lorempixel.com/640/480/city,0,Saepe sit iure sit ullam.
259,21,http://lorempixel.com/640/480/city,1,Dolorum aut saepe maiores tempore.
260,21,http://lorempixel.com/640/480/city,2,Non accusamus incidunt eum voluptas.
261,21,http://lorempixel.com/640/480/city,3,Eum quae qui laudantium omnis.
262,21,http://lorempixel.com/640/480/city,4,Magni non est ut ea.
263,21,http://lorempixel.com/640/480/city,5,Molestias sint aut nobis praesentium.
264,21,http://lorempixel.com/640/480/city,6,Id voluptatem et dolorem totam.
265,21,http://lorempixel.com/640/480/city,7,Quae quia ipsam saepe necessitatibus.
266,21,http://lorempixel.com/640/480/city,8,Dolor ipsum fuga velit veniam.
267,21,http://lorempixel.com/640/480/city,9,Labore rem unde facere necessitatibus.
268,21,http://lorempixel.com/640/480/city,10,Maiores dolore ut consequatur aperiam.
269,21,http://lorempixel.com/640/480/city,11,Natus debitis numquam eaque sed.
270,22,http://lorempixel.com/640/480/city,0,Ipsum est enim quod quia.
271,22,http://lorempixel.com/640/480/city,1,Ut accusantium consequatur quibusdam voluptatum.
272,22,http://lorempixel.com/640/480/city,2,Atque eveniet minus vel accusamus.
273,22,http://lorempixel.com/640/480/city,3,Vel consequuntur ratione sit beatae.
274,22,http://lorempixel.com/640/480/city,4,Tenetur dolorum quibusdam doloribus ut.
275,22,http://lorempixel.com/640/480/city,5,Quia dolor ducimus ut nemo.
276,22,http://lorempixel.com/640/480/city,6,Autem assumenda ex voluptatem sit.
277,22,http://lorempixel.com/640/480/city,7,Velit enim nihil harum molestiae.
278,22,http://lorempixel.com/640/480/city,8,Accusantium rerum aut dolorum velit.
279,22,http://lorempixel.com/640/480/city,9,In aut aut optio earum.
280,22,http://lorempixel.com/640/480/city,10,Consequatur sint maxime similique quia.
281,22,http://lorempixel.com/640/480/city,11,Consequatur quo eligendi illo sapiente.
282,22,http://lorempixel.com/640/480/city,12,Nam vitae ea dolorum sit.
283,22,http://lorempixel.com/640/480/city,13,Neque perspiciatis veritatis aperiam suscipit.
284,22,http://lorempixel.com/640/480/city,14,Quis sunt molestiae ad quia.
285,22,http://lorempixel.com/640/480/city,15,Dicta eum id quod quisquam.
286,22,http://lorempixel.com/640/480/city,16,Sed quia pariatur et commodi.
287,22,http://lorempixel.com/640/480/city,17,Voluptatibus molestiae mollitia accusantium iusto.
288,22,http://lorempixel.com/640/480/city,18,Accusamus rerum beatae tempora omnis.
289,22,http://lorempixel.com/640/480/city,19,Est provident non earum ipsam.
290,22,http://lorempixel.com/640/480/city,20,Dolorum vel fugit atque iste.
291,22,http://lorempixel.com/640/480/city,21,Et porro fugit nulla rem.
292,22,http://lorempixel.com/640/480/city,22,Est facilis et et blanditiis.
293,23,http://lorempixel.com/640/480/city,0,Repellat et voluptatibus voluptatem ut.
294,23,http://lorempixel.com/640/480/city,1,Eligendi nihil itaque enim est.
295,23,http://lorempixel.com/640/480/city,2,Voluptatem ut ipsum enim sequi.
296,24,http://lorempixel.com/640/480/city,0,Voluptatum inventore rerum aliquid voluptas.
297,24,http://lorempixel.com/640/480/city,1,Aut distinctio quidem maiores fugiat.
298,24,http://lorempixel.com/640/480/city,2,Eligendi consequatur beatae corrupti dicta.
299,24,http://lorempixel.com/640/480/city,3,Non et numquam velit dolor.
300,24,http://lorempixel.com/640/480/city,4,Ex voluptatem tenetur aut iste.
301,24,http://lorempixel.com/640/480/city,5,Veritatis suscipit nihil ut suscipit.
302,24,http://lorempixel.com/640/480/city,6,Sit mollitia saepe asperiores eum.
303,25,http://lorempixel.com/640/480/city,0,Ut debitis quam aut deleniti.
304,25,http://lorempixel.com/640/480/city,1,Nemo quia sed impedit et.
305,25,http://lorempixel.com/640/480/city,2,Consequatur voluptatem voluptatem vero quis.
306,25,http://lorempixel.com/640/480/city,3,Ea aperiam sint ut itaque.
307,25,http://lorempixel.com/640/480/city,4,Sit explicabo sint blanditiis omnis.
308,26,http://lorempixel.com/640/480/city,0,Veritatis facilis possimus magnam voluptatum.
309,26,http://lorempixel.com/640/480/city,1,Dolores aut qui rerum eligendi.
310,26,http://lorempixel.com/640/480/city,2,Ut quisquam doloribus consequatur nisi.
311,26,http://lorempixel.com/640/480/city,3,Voluptatem sit consequatur autem voluptate.
312,26,http://lorempixel.com/640/480/city,4,Nisi inventore et voluptatem et.
313,26,http://lorempixel.com/640/480/city,5,Ducimus ratione explicabo eaque enim.
314,26,http://lorempixel.com/640/480/city,6,Non laudantium eius quis qui.
315,26,http://lorempixel.com/640/480/city,7,Sit ullam dolores aspernatur unde.
316,26,http://lorempixel.com/640/480/city,8,Eum qui eligendi at dolores.
317,26,http://lorempixel.com/640/480/city,9,Aut aliquam impedit quas mollitia.
318,26,http://lorempixel.com/640/480/city,10,Fugiat debitis exercitationem non placeat.
319,26,http://lorempixel.com/640/480/city,11,Quam sequi ducimus sapiente doloribus.
320,26,http://lorempixel.com/640/480/city,12,Et deserunt fuga quas itaque.
321,26,http://lorempixel.com/640/480/city,13,Voluptate accusantium quos sequi omnis.
322,26,http://lorempixel.com/640/480/city,14,Porro praesentium soluta molestiae molestias.
323,26,http://lorempixel.com/640/480/city,15,Quos qui labore ut dolorum.
324,26,http://lorempixel.com/640/480/city,16,Sit ratione non at fugit.
325,26,http://lorempixel.com/640/480/city,17,Provident est dolor nesciunt blanditiis.
326,26,http://lorempixel.com/640/480/city,18,Quisquam cumque culpa ex odit.
327,26,http://lorempixel.com/640/480/city,19,Tempora eveniet laborum minus animi.
328,26,http://lorempixel.com/640/480/city,20,Quas voluptas qui vel voluptatem.
