_id,listing_id,photo_url,priority,caption
1308,98,http://lorempixel.com/640/480/city,22,Qui soluta at tempore esse.
1309,99,http://lorempixel.com/640/480/city,0,Sunt animi ipsam eum et.
1310,99,http://lorempixel.com/640/480/city,1,Minus vitae inventore sit natus.
1311,99,http://lorempixel.com/640/480/city,2,Iure architecto nostrum quos alias.
1312,99,http://lorempixel.com/640/480/city,3,Rerum qui provident et occaecati.
1313,99,http://lorempixel.com/640/480/city,4,Id repudiandae ab atque magni.
1314,99,http://lorempixel.com/640/480/city,5,Iusto voluptatem est voluptatem ut.
1315,99,http://lorempixel.com/640/480/city,6,Accusantium voluptatem est consequatur consequatur.
1316,99,http://lorempixel.com/640/480/city,7,Id soluta molestiae laudantium enim.
1317,99,http://lorempixel.com/640/480/city,8,Enim optio porro mollitia explicabo.
1318,99,http://lorempixel.com/640/480/city,9,Veritatis assumenda quas quos deleniti.
1319,99,http://lorempixel.com/640/480/city,10,Ratione adipisci similique dicta reprehenderit.
1320,99,http://lorempixel.com/640/480/city,11,Error ex possimus accusamus nam.
1321,99,http://lorempixel.com/640/480/city,12,Molestiae minima debitis eos nostrum.
1322,99,http://lorempixel.com/640/480/city,13,Dolorum quasi est tempora eum.
1323,99,http://lorempixel.com/640/480/city,14,Adipisci rerum consectetur quibusdam iusto.
1324,99,http://lorempixel.com/640/480/city,15,Quibusdam blanditiis qui aut voluptatibus.
1325,99,http://lorempixel.com/640/480/city,16,Et laborum beatae inventore sit.
1326,99,http://lorempixel.com/640/480/city,17,Aut fugiat qui voluptatibus maxime.
1327,99,http://lorempixel.com/640/480/city,18,Tenetur unde temporibus adipisci rerum.
1328,100,http://lorempixel.com/640/480/city,0,Natus sed aut est quos.
1329,100,http://lorempixel.com/640/480/city,1,Ab beatae et reiciendis omnis.
1330,100,http://lorempixel.com/640/480/city,2,Dolore et recusandae quo unde.
1331,100,http://lorempixel.com/640/480/city,3,Architecto nobis veritatis alias doloremque.
1332,100,http://lorempixel.com/640/480/city,4,Quasi ullam et vitae non.
1333,100,http://lorempixel.com/640/480/city,5,Dolor dolore quibusdam id magnam.
1334,100,http://lorempixel.com/640/480/city,6,Culpa ut error sed optio.
1335,100,http://lorempixel.com/640/480/city,7,Veniam qui recusandae saepe optio.
1336,100,http://lorempixel.com/640/480/city,8,Aut velit est soluta harum.
1337,100,http://lorempixel.com/640/480/city,9,Ut soluta ab velit explicabo.
1338,100,http://lorempixel.com/640/480/city,10,Ea velit neque provident qui.
1339,100,http://lorempixel.com/640/480/city,11,Nihil laborum esse in quis.
1340,100,http://lorempixel.com/640/480/city,12,Magni repellat ut repudiandae enim.
1341,100,http://lorempixel.com/640/480/city,13,Eligendi reprehenderit dolorum autem rerum.
1342,100,http://lorempixel.com/640/480/city,14,Repudiandae veniam aliquid quia qui.
1343,100,http://lorempixel.com/640/480/city,15,Aliquid dignissimos eos sapiente veritatis.
1344,100,http://lorempixel.com/640/480/city,16,Tenetur ducimus exercitationem tempore cumque.
1345,100,http://lorempixel.com/640/480/city,17,Est dolores velit qui nobis.
1346,100,http://lorempixel.com/640/480/city,18,A nobis porro aliquid qui.
1347,100,http://lorempixel.com/640/480/city,19,Et unde voluptatem id qui.
1348,100,http://lorempixel.com/640/480/city,20,Blanditiis ea aliquid blanditiis qui.
1349,101,http://lorempixel.com/640/480/city,0,Voluptatem dolor nobis excepturi quos.
1350,101,http://lorempixel.com/640/480/city,1,Illo tenetur et delectus beatae.
1351,101,http://lorempixel.com/640/480/city,2,Magnam neque quia distinctio numquam.
1352,102,http://lorempixel.com/640/480/city,0,Saepe placeat ipsum cum quod.
1353,102,http://lorempixel.com/640/480/city,1,Porro eligendi quaerat et unde.
1354,102,http://lorempixel.com/640/480/city,2,Nemo est voluptas dolorem quis.
1355,102,http://lorempixel.com/640/480/city,3,Voluptas commodi molestiae id quod.
1356,102,http://lorempixel.com/640/480/city,4,Ut cumque voluptas sequi reiciendis.
1357,102,http://lorempixel.com/640/480/city,5,Consequuntur quasi qui magnam possimus.
1358,102,http://lorempixel.com/640/480/city,6,Corporis quia modi tempore soluta.
1359,102,http://lorempixel.com/640/480/city,7,Mollitia nulla corrupti quos aut.
1360,102,http://lorempixel.com/640/480/city,8,Consequatur corrupti est quidem non.
1361,102,http://lorempixel.com/640/480/city,9,Officiis nihil dolorum doloribus quia.
1362,102,http://lorempixel.com/640/480/city,10,Omnis possimus doloribus ut ut.
1363,103,http://lorempixel.com/640/480/city,0,Quo impedit occaecati possimus et.
1364,103,http://lorempixel.com/640/480/city,1,Omnis et officiis iure et.
1365,103,http://lorempixel.com/640/480/city,2,Ex animi debitis incidunt officiis.
1366,103,http://lorempixel.com/640/480/city,3,Voluptatum corrupti impedit quis odit.
1367,103,http://lorempixel.com/640/480/city,4,Et et quidem ex dolor.
1368,103,http://lorempixel.com/640/480/city,5,Eum et qui non fuga.
1369,103,http://lorempixel.com/640/480/city,6,Est deserunt molestias veritatis perspiciatis.
1370,103,http://lorempixel.com/640/480/city,7,Voluptas provident sunt dignissimos nihil.
1371,103,http://lorempixel.com/640/480/city,8,Perspiciatis aut aut voluptatem quia.
1372,103,http://lorempixel.com/640/480/city,9,Quia est qui vel sint.
1373,103,http://lorempixel.com/640/480/city,10,Qui natus ut repudiandae ut.
1374,103,http://lorempixel.com/640/480/city,11,Impedit dolor itaque voluptas architecto.
1375,103,http://lorempixel.com/640/480/city,12,Ea et quo quas sint.
1376,103,http://lorempixel.com/640/480/city,13,Aliquid commodi quasi rerum quasi.
1377,103,http://lorempixel.com/640/480/city,14,Placeat tenetur voluptatem vero praesentium.
1378,103,http://lorempixel.com/640/480/city,15,Nisi sed et eaque reiciendis.
1379,103,http://lorempixel.com/640/480/city,16,Amet voluptatem accusantium accusamus voluptate.
1380,103,http://lorempixel.com/640/480/city,17,Aut vel dolor similique illo.
1381,103,http://lorempixel.com/640/480/city,18,Rerum aut tempore laborum ut.
1382,103,http://lorempixel.com/640/480/city,19,Alias distinctio aliquid pariatur ad.
1383,103,http://lorempixel.com/640/480/city,20,Quasi harum qui id odio.
1384,104,http://lorempixel.com/640/480/city,0,Sed dolorem corporis quod quis.
1385,104,http://lorempixel.com/640/480/city,1,Aperiam alias sed tempore commodi.
1386,104,http://lorempixel.com/640/480/city,2,Eaque et quidem occaecati ratione.
1387,104,http://lorempixel.com/640/480/city,3,Esse perspiciatis beatae est libero.
1388,104,http://lorempixel.com/640/480/city,4,Facilis consectetur sint sed error.
1389,104,http://lorempixel.com/640/480/city,5,Repellat dolores ut accusantium ipsum.
1390,104,http://lorempixel.com/640/480/city,6,Velit soluta neque est libero.
1391,104,http://lorempixel.com/640/480/city,7,Aut autem corporis sint quibusdam.
1392,104,http://lorempixel.com/640/480/city,8,Sed qui sit repellendus sint.
1393,104,http://lorempixel.com/640/480/city,9,Quo ipsam autem et dolores.
1394,104,http://lorempixel.com/640/480/city,10,Hic dolorum provident id aut.
1395,104,http://lorempixel.com/640/480/city,11,Laboriosam ut distinctio delectus est.
1396,105,http://lorempixel.com/640/480/city,0,Commodi nemo eligendi sed eum.
1397,105,http://lorempixel.com/640/480/city,1,Velit omnis ipsam nam id.
1398,105,http://lorempixel.com/640/480/city,2,Libero dolorem dicta dolor accusamus.
1399,105,http://lorempixel.com/640/480/city,3,Sit dolores ea ratione similique.
1400,105,http://lorempixel.com/640/480/city,4,Eos sunt veniam architecto inventore.
1401,105,http://lorempixel.com/640/480/city,5,Iure dignissimos eos in voluptatem.
1402,105,http://lorempixel.com/640/480/city,6,Deserunt est autem autem amet.
1403,105,http://lorempixel.com/640/480/city,7,Provident et fugiat hic et.
1404,105,http://lorempixel.com/640/480/city,8,Qui iusto iusto quas inventore.
1405,105,http://lorempixel.com/640/480/city,9,Assumenda tenetur ab adipisci omnis.
1406,105,http://lorempixel.com/640/480/city,10,Quis earum animi et ut.
1407,105,http://lorempixel.com/640/480/city,11,Nisi nemo voluptate mollitia a.
1408,105,http://lorempixel.com/640/480/city,12,Deserunt soluta sunt sint laboriosam.
1409,105,http://lorempixel.com/640/480/city,13,Doloribus a laudantium rerum iusto.
1410,105,http://lorempixel.com/640/480/city,14,Cum beatae quia vero impedit.
1411,105,http://lorempixel.com/640/480/city,15,Maxime libero tempora sint aut.
1412,105,http://lorempixel.com/640/480/city,16,Voluptatem dolorem non fuga molestiae.
1413,105,http://lorempixel.com/640/480/city,17,Quisquam illo distinctio omnis quia.
1414,105,http://lorempixel.com/640/480/city,18,Vitae facilis eos sapiente maxime.
1415,105,http://lorempixel.com/640/480/city,19,Repellat minima omnis maxime aliquid.
1416,105,http://lorempixel.com/640/480/city,20,Quos maxime ut et et.
1417,105,http://lorempixel.com/640/480/city,21,Est et aut amet sed.
1418,105,http://lorempixel.com/640/480/city,22,Aut aut sit excepturi fuga.
1419,105,http://lorempixel.com/640/480/city,23,Tempore rerum repellendus est sint.
1420,105,http://lorempixel.com/640/480/city,24,Non est praesentium sed voluptatem.
1421,105,http://lorempixel.com/640/480/city,25,Tempora deserunt temporibus ipsa iste.
1422,105,http://lorempixel.com/640/480/city,26,Aspernatur est eveniet cumque voluptatem.
1423,105,http://lorempixel.com/640/480/city,27,Culpa saepe rem quo autem.
1424,105,http://lorempixel.com/640/480/city,28,Minus sunt numquam non labore.
1425,106,http://lorempixel.com/640/480/city,0,Magnam quibusdam sunt nihil rerum.
1426,106,http://lorempixel.com/640/480/city,1,Quia dignissimos qui est libero.
1427,106,http://lorempixel.com/640/480/city,2,Incidunt reprehenderit qui consectetur illum.
1428,106,http://lorempixel.com/640/480/city,3,Provident qui dolores maiores omnis.
1429,106,http://lorempixel.com/640/480/city,4,Totam facilis fugiat molestias aliquam.
1430,106,http://lorempixel.com/640/480/city,5,Cum voluptates aut veritatis et.
1431,106,http://lorempixel.com/640/480/city,6,Officia aliquam occaecati dicta id.
1432,106,http://lorempixel.com/640/480/city,7,Quasi veniam quo labore dolores.
1433,106,http://lorempixel.com/640/480/city,8,Ipsam enim mollitia ad dolorum.
1434,106,http://lorempixel.com/640/480/city,9,Eveniet culpa maxime at voluptatibus.
1435,106,http://lorempixel.com/640/480/city,10,Quo pariatur perspiciatis et impedit.
1436,106,http://lorempixel.com/640/480/city,11,Dolore sed accusamus inventore corrupti.
1437,106,http://lorempixel.com/640/480/city,12,Sit consectetur architecto quos autem.
1438,106,http://lorempixel.com/640/480/city,13,Non vel quae sint est.
1439,106,http://lorempixel.com/640/480/city,14,Quia inventore mollitia exercitationem velit.
1440,106,http://lorempixel.com/640/480/city,15,Non sint vel sit magni.
1441,107,http://lorempixel.com/640/480/city,0,Molestiae possimus sint nobis aspernatur.
1442,107,http://lorempixel.com/640/480/city,1,Non animi aliquam error modi.
1443,107,http://lorempixel.com/640/480/city,2,Commodi est dolorem qui quibusdam.
1444,107,http://lorempixel.com/640/480/city,3,Nihil consequuntur animi aperiam nostrum.
1445,107,http://lorempixel.com/640/480/city,4,Fuga commodi quia quidem atque.
1446,107,http://lorempixel.com/640/480/city,5,Expedita doloribus quis rerum eum.
1447,107,http://lorempixel.com/640/480/city,6,Pariatur et et distinctio cupiditate.
1448,107,http://lorempixel.com/640/480/city,7,Laborum iste dolorem et culpa.
1449,107,http://lorempixel.com/640/480/city,8,Nam tempore ad deleniti ipsa.
1450,107,http://lorempixel.com/640/480/city,9,Sit debitis consequuntur delectus dolorum.
1451,107,http://lorempixel.com/640/480/city,10,Sapiente eaque qui fugiat corrupti.
1452,107,http://lorempixel.com/640/480/city,11,Maxime optio aliquid exercitationem commodi.
1453,107,http://lorempixel.com/640/480/city,12,Quasi iusto eos eum voluptatibus.
1454,107,http://lorempixel.com/640/480/city,13,Error ratione corporis est ratione.
1455,107,http://lorempixel.com/640/480/city,14,Qui nesciunt doloribus error rem.
1456,107,http://lorempixel.com/640/480/city,15,Non architecto voluptas aspernatur laboriosam.
1457,107,http://lorempixel.com/640/480/city,16,Deserunt quis quos possimus totam.
1458,107,http://lorempixel.com/640/480/city,17,Beatae est eos natus accusamus.
1459,107,http://lorempixel.com/640/480/city,18,Ea non quas eos fugit.
1460,107,http://lorempixel.com/640/480/city,19,Est error soluta explicabo sequi.
1461,107,http://lorempixel.com/640/480/city,20,Quidem nobis ut voluptatum libero.
1462,107,http://lorempixel.com/640/480/city,21,Minus suscipit et nostrum tenetur.
1463,107,http://lorempixel.com/640/480/city,22,Animi reiciendis consectetur qui dolor.
1464,107,http://lorempixel.com/640/480/city,23,Repellat odio id quia ea.
1465,107,http://lorempixel.com/640/480/city,24,Repellendus quaerat dolores ullam quia.
1466,107,http://lorempixel.com/640/480/city,25,Eos qui voluptatum placeat reprehenderit.
1467,107,http://lorempixel.com/640/480/city,26,Quaerat veniam consequatur recusandae ex.
1468,108,http://lorempixel.com/640/480/city,0,Iure a aperiam esse suscipit.
1469,108,http://lorempixel.com/640/480/city,1,Aut atque aut deserunt saepe.
1470,108,http://lorempixel.com/640/480/city,2,Esse natus nostrum omnis nemo.
1471,108,http://lorempixel.com/640/480/city,3,Omnis vel iure nisi non.
1472,108,http://lorempixel.com/640/480/city,4,Dolorem sit in ab assumenda.
1473,108,http://lorempixel.com/640/480/city,5,Neque voluptatem autem earum eius.
1474,108,http://lorempixel.com/640/480/city,6,Mollitia officia sit dolorum voluptatem.
1475,108,http://lorempixel.com/640/480/city,7,Omnis aliquid asperiores sunt dolor.
1476,108,http://lorempixel.com/640/480/city,8,Odit laudantium similique consequatur et.
1477,108,http://lorempixel.com/640/480/city,9,Numquam a et dolorum et.
1478,108,http://lorempixel.com/640/480/city,10,Aut molestiae qui expedita vitae.
1479,108,http://lorempixel.com/640/480/city,11,Soluta et sint sit qui.
1480,109,http://lorempixel.com/640/480/city,0,Reprehenderit est eos labore in.
1481,109,http://lorempixel.com/640/480/city,1,Sit eum est ea voluptatibus.
1482,109,http://lorempixel.com/640/480/city,2,Omnis dolor voluptatibus qui quo.
1483,109,http://lorempixel.com/640/480/city,3,Aliquam suscipit et excepturi ut.
1484,109,http://lorempixel.com/640/480/city,4,Est aut ratione quaerat eum.
1485,109,http://lorempixel.com/640/480/city,5,Voluptas laborum et ut voluptas.
1486,109,http://lorempixel.com/640/480/city,6,Eaque unde dolor odio neque.
1487,109,http://lorempixel.com/640/480/city,7,Nam praesentium omnis architecto enim.
1488,109,http://lorempixel.com/640/480/city,8,Adipisci ut libero soluta temporibus.
1489,109,http://lorempixel.com/640/480/city,9,Nostrum mollitia optio inventore molestiae.
1490,109,http://lorempixel.com/640/480/city,10,Aut autem aut numquam autem.
1491,109,http://lorempixel.com/640/480/city,11,Veniam fuga exercitationem odit repellat.
1492,109,http://lorempixel.com/640/480/city,12,Voluptatem accusamus et soluta animi.
1493,109,http://lorempixel.com/640/480/city,13,Sed voluptas distinctio laudantium maxime.
1494,109,http://lorempixel.com/640/480/city,14,Explicabo ullam nesciunt perspiciatis mollitia.
1495,109,http://lorempixel.com/640/480/city,15,A sequi ullam neque recusandae.
1496,109,http://lorempixel.com/640/480/city,16,Beatae est harum est accusantium.
1497,109,http://lorempixel.com/640/480/city,17,Pariatur occaecati ullam beatae unde.
1498,109,http://lorempixel.com/640/480/city,18,Expedita aut aut perferendis voluptate.
1499,109,http://lorempixel.com/640/480/city,19,Error reiciendis ipsa inventore quo.
1500,109,http://lorempixel.com/640/480/city,20,Rerum occaecati earum perspiciatis voluptatem.
1501,109,http://lorempixel.com/640/480/city,21,Ipsa cupiditate omnis et in.
1502,109,http://lorempixel.com/640/480/city,22,Modi quia labore animi totam.
1503,109,http://lorempixel.com/640/480/city,23,Ea perspiciatis placeat beatae omnis.
1504,110,http://lorempixel.com/640/480/city,0,Omnis aliquid culpa voluptatum nam.
1505,110,http://lorempixel.com/640/480/city,1,Perspiciatis qui adipisci corrupti adipisci.
1506,110,http://lorempixel.com/640/480/city,2,Maxime eos deleniti quia consequuntur.
1507,110,http://lorempixel.com/640/480/city,3,Sapiente rerum alias sapiente et.
1508,110,http://lorempixel.com/640/480/city,4,Mollitia sit aut aliquid beatae.
1509,110,http://lorempixel.com/640/480/city,5,Debitis iste illo cumque quis.
1510,110,http://lorempixel.com/640/480/city,6,Dolorum reprehenderit voluptates molestias eius.
1511,110,http://lorempixel.com/640/480/city,7,Explicabo consequatur exercitationem veniam aut.
1512,110,http://lorempixel.com/640/480/city,8,Praesentium ut quo quidem in.
1513,111,http://lorempixel.com/640/480/city,0,Blanditiis distinctio quisquam facere maiores.
1514,111,http://lorempixel.com/640/480/city,1,Aspernatur quo iusto aliquid ipsa.
1515,111,http://lorempixel.com/640/480/city,2,Quis quae voluptatem aut est.
1516,111,http://lorempixel.com/640/480/city,3,Ipsam quod in vitae suscipit.
1517,111,http://lorempixel.com/640/480/city,4,Architecto enim doloribus qui inventore.
1518,111,http://lorempixel.com/640/480/city,5,Aut ullam ea rerum et.
1519,111,http://lorempixel.com/640/480/city,6,Fuga esse aut ut et.
1520,111,http://lorempixel.com/640/480/city,7,Rem est consequatur ea facere.
1521,111,http://lorempixel.com/640/480/city,8,Quisquam est qui at mollitia.
1522,111,http://lorempixel.com/640/480/city,9,Et repellat blanditiis quia soluta.
1523,112,http://lorempixel.com/640/480/city,0,Delectus dolor ut eaque officia.
1524,112,http://lorempixel.com/640/480/city,1,Adipisci reiciendis consequatur sapiente et.
1525,112,http://lorempixel.com/640/480/city,2,Quisquam qui harum et odit.
1526,112,http://lorempixel.com/640/480/city,3,Asperiores quas soluta libero aperiam.
1527,112,http://lorempixel.com/640/480/city,4,Placeat at et nihil in.
1528,112,http://lorempixel.com/640/480/city,5,A sed alias qui nam.
1529,112,http://lorempixel.com/640/480/city,6,Sequi omnis sed ab dolorum.
1530,112,http://lorempixel.com/640/480/city,7,Asperiores voluptatem in magni ut.
1531,112,http://lorempixel.com/640/480/city,8,Itaque modi magni expedita minus.
1532,112,http://lorempixel.com/640/480/city,9,Eum veritatis consequatur dolore sed.
1533,112,http://lorempixel.com/640/480/city,10,Ea tempora perspiciatis fuga explicabo.
1534,112,http://lorempixel.com/640/480/city,11,Est est repellat quibusdam consequuntur.
1535,112,http://lorempixel.com/640/480/city,12,Praesentium voluptas blanditiis quisquam reiciendis.
1536,112,http://lorempixel.com/640/480/city,13,Quos molestiae quaerat et est.
1537,112,http://lorempixel.com/640/480/city,14,Rerum sint adipisci est voluptatibus.
1538,112,http://lorempixel.com/640/480/city,15,Sit cum delectus magnam fugiat.
1539,112,http://lorempixel.com/640/480/city,16,Harum dolor alias voluptatem sunt.
1540,112,http://lorempixel.com/640/480/city,17,Aut eligendi quibusdam voluptatum accusamus.
1541,112,http://lorempixel.com/640/480/city,18,Asperiores et ea magnam omnis.
1542,112,http://lorempixel.com/640/480/city,19,Et facere doloribus velit sequi.
1543,112,http://lorempixel.com/640/480/city,20,Nam quam occaecati repudiandae vitae.
1544,112,http://lorempixel.com/640/480/city,21,Sapiente pariatur cumque sed est.
1545,112,http://lorempixel.com/640/480/city,22,Repudiandae unde assumenda illum sed.
1546,112,http://lorempixel.com/640/480/city,23,Placeat odio aperiam inventore mollitia.
1547,112,http://lorempixel.com/640/480/city,24,Est nulla quia enim tempora.
1548,112,http://lorempixel.com/640/480/city,25,Alias placeat perspiciatis non dolorum.
1549,112,http://lorempixel.com/640/480/city,26,Ea non et ea quia.
1550,112,http://lorempixel.com/640/480/city,27,Nihil molestiae voluptas suscipit nam.
1551,113,http://lorempixel.com/640/480/city,0,Qui consectetur itaque voluptate et.
1552,113,http://lorempixel.com/640/480/city,1,Provident id aperiam numquam voluptatem.
1553,113,http://lorempixel.com/640/480/city,2,Nulla excepturi dolor et non.
1554,113,http://lorempixel.com/640/480/city,3,Quia nihil rem et quia.
1555,113,http://lorempixel.com/640/480/city,4,Non a ut praesentium nostrum.
1556,113,http://lorempixel.com/640/480/city,5,Iusto qui at cumque eius.
1557,113,http://lorempixel.com/640/480/city,6,Sit aliquam voluptatum et et.
1558,113,http://lorempixel.com/640/480/city,7,Et omnis sunt enim aut.
1559,113,http://lorempixel.com/640/480/city,8,Exercitationem facere commodi quas earum.
1560,113,http://lorempixel.com/640/480/city,9,Facilis dicta cum aliquam officia.
1561,113,http://lorempixel.com/640/480/city,10,Placeat minus rem accusamus et.
1562,113,http://lorempixel.com/640/480/city,11,Mollitia iste corporis ea impedit.
1563,113,http://lorempixel.com/640/480/city,12,Ut itaque facilis exercitationem debitis.
1564,114,http://lorempixel.com/640/480/city,0,Vero id a qui nesciunt.
1565,114,http://lorempixel.com/640/480/city,1,Enim alias labore distinctio nam.
1566,114,http://lorempixel.com/640/480/city,2,Aut dolores fuga assumenda qui.
1567,114,http://lorempixel.com/640/480/city,3,Nihil non animi sint odio.
1568,114,http://lorempixel.com/640/480/city,4,Voluptatem consequatur sunt reprehenderit dolores.
1569,114,http://lorempixel.com/640/480/city,5,Rerum laboriosam accusamus in qui.
1570,114,http://lorempixel.com/640/480/city,6,Aut esse error consequuntur consequatur.
1571,114,http://lorempixel.com/640/480/city,7,A nam inventore autem eligendi.
1572,114,http://lorempixel.com/640/480/city,8,Ut necessitatibus natus magnam veniam.
1573,114,http://lorempixel.com/640/480/city,9,Ducimus dolores sed eum aliquid.
1574,114,http://lorempixel.com/640/480/city,10,Assumenda quis repellat at veniam.
1575,114,http://lorempixel.com/640/480/city,11,Consequatur debitis sit error aut.
1576,114,http://lorempixel.com/640/480/city,12,Possimus eaque dolor eaque illo.
1577,114,http://lorempixel.com/640/480/city,13,Autem facere rerum omnis fugit.
1578,114,http://lorempixel.com/640/480/city,14,Corrupti facilis ut magni aut.
1579,114,http://lorempixel.com/640/480/city,15,Maxime vitae enim accusamus veniam.
1580,114,http://lorempixel.com/640/480/city,16,Expedita aliquid itaque eos quo.
1581,114,http://lorempixel.com/640/480/city,17,Omnis ut amet enim molestiae.
1582,114,http://lorempixel.com/640/480/city,18,Magnam molestias non in reiciendis.
1583,114,http://lorempixel.com/640/480/city,19,Possimus consequuntur aut magnam ut.
1584,114,http://lorempixel.com/640/480/city,20,Nihil nostrum magni voluptas provident.
1585,114,http://lorempixel.com/640/480/city,21,Inventore qui rem omnis iure.
1586,114,http://lorempixel.com/640/480/city,22,Ipsam nobis voluptatem veritatis debitis.
1587,114,http://lorempixel.com/640/480/city,23,Qui quaerat inventore rem aut.
1588,114,http://lorempixel.com/640/480/city,24,Non alias dolorem rem a.
1589,114,http://lorempixel.com/640/480/city,25,At autem saepe quos a.
1590,114,http://lorempixel.com/640/480/city,26,Facilis tempora est sed veniam.
1591,114,http://lorempixel.com/640/480/city,27,Voluptatum hic laborum quaerat eos.
1592,114,http://lorempixel.com/640/480/city,28,Dolores itaque voluptas similique aut.
1593,115,http://lorempixel.com/640/480/city,0,Et voluptatibus odit debitis aut.
1594,115,http://lorempixel.com/640/480/city,1,Aliquam sapiente sint vel quam.
1595,115,http://lorempixel.com/640/480/city,2,Repellat cumque sequi placeat nesciunt.
1596,115,http://lorempixel.com/640/480/city,3,Omnis perferendis velit sed laudantium.
1597,115,http://lorempixel.com/640/480/city,4,Repellat reiciendis in eaque qui.
1598,115,http://lorempixel.com/640/480/city,5,Molestiae voluptatem veniam dolor at.
1599,115,http://lorempixel.com/640/480/city,6,Suscipit eos delectus voluptatibus qui.
1600,115,http://lorempixel.com/640/480/city,7,Magnam reiciendis odio tempora fuga.
1601,115,http://lorempixel.com/640/480/city,8,Labore asperiores nam ullam hic.
1602,115,http://lorempixel.com/640/480/city,9,Ad quae non quo recusandae.
1603,115,http://lorempixel.com/640/480/city,10,Quidem non voluptas magni culpa.
1604,115,http://lorempixel.com/640/480/city,11,Autem numquam id quod autem.
1605,115,http://lorempixel.com/640/480/city,12,Labore cum perspiciatis voluptatibus molestiae.
1606,115,http://lorempixel.com/640/480/city,13,Laborum impedit rem nisi voluptas.
1607,115,http://lorempixel.com/640/480/city,14,Laudantium odit voluptatem facilis et.
1608,115,http://lorempixel.com/640/480/city,15,Ratione omnis est optio voluptas.
1609,115,http://lorempixel.com/640/480/city,16,Quo id harum beatae non.
1610,115,http://lorempixel.com/640/480/city,17,Assumenda rem eum voluptatibus sit.
1611,115,http://lorempixel.com/640/480/city,18,Delectus pariatur officia suscipit accusantium.
1612,118,http://lorempixel.com/640/480/city,0,Enim soluta soluta qui et.
1613,118,http://lorempixel.com/640/480/city,1,Et sit ut sit corporis.
1614,118,http://lorempixel.com/640/480/city,2,Et corrupti et eaque reiciendis.
1615,118,http://lorempixel.com/640/480/city,3,Totam velit enim voluptatem ipsa.
1616,118,http://lorempixel.com/640/480/city,4,Quos reprehenderit necessitatibus et exercitationem.
1617,118,http://lorempixel.com/640/480/city,5,Excepturi deleniti culpa blanditiis dolorem.
1618,118,http://lorempixel.com/640/480/city,6,Unde unde et sapiente beatae.
1619,118,http://lorempixel.com/640/480/city,7,Voluptas sed vel est ut.
1620,118,http://lorempixel.com/640/480/city,8,Odio esse placeat iusto autem.
1621,118,http://lorempixel.com/640/480/city,9,Natus fuga aut tempore quia.
1622,118,http://lorempixel.com/640/480/city,10,Harum reiciendis consequatur quibusdam corporis.
1623,118,http://lorempixel.com/640/480/city,11,Qui et reprehenderit est deleniti.
1624,118,http://lorempixel.com/640/480/city,12,Voluptatem dolorum labore occaecati molestiae.
1625,118,http://lorempixel.com/640/480/city,13,Iusto eaque laudantium inventore quod.
1626,118,http://lorempixel.com/640/480/city,14,Autem ut id occaecati tempore.
1627,118,http://lorempixel.com/640/480/city,15,Et veritatis excepturi nesciunt cum.
